name,Name,Description,Special Effect
Async Flesh Party,Exsurgent Infection,"Flesh parties exude the exsurgent nanovirus. Treat it as a nanoplague (p. 172) with dermal, inhalation, and injection vectors and an Infection Rating of 40.",
Async Flesh Party,Wound Invulnerability,Flesh parties are immune to wound effects.,
Async Flesh Party,Regeneration,Flesh parties regenerate 1d10 damage per hour.,
Barbed Eel,Shock Invulnerability,Barbed eels are immune to shock effects.,
Blister Beast,Blister Defense,"Any time the blister beast is struck, there is a (40 + DV inflicted)% chance that one or more blisters burst and release a neurotoxin cloud.",
Blister Beast,Blister Neurotoxin Cloud,"No defense. 5 meter radius effect. Dermal, Inhalation; Onset Time: 1 Action Turn; Duration: 5 Action Turns. Victims take DV 1d10 per Action Turn they remain in the cloud from caustic irritation and blistering and must make a SOM x 3 Test or be blinded for 1 hour. Characters without contained breathing systems like a vacsuit are incapacitated due to choking for 1 minute; success on a SOM x 2 Test negates this, but still inflicts a −20 modifier to all other actions for 1 minute (5 Action Turns with medichines).",
Blister Beast,Leap,Blister beasts can horizontally jump 6 meters (running)/2 meters (standing) and vertically jump 2 meters; +1/0.25/0.25 meters (respectively) per 10 MoS on as Freerunning Test.,
Blister Beast,Paralytic Sting Toxin,Injected; Onset Time: 1 Action Turn; Duration: 5 Action Turns/1 hour. Victims are paralyzed for 1 hour and take DV 1d10 per Action Turn for 5 Turns. A SOM x 3 Test will negate the paralysis and halve the damage.,
Causapod,Armored Spike Variant,"Carapace Armor 9/9, Rushing Spike Attack 40, 2d10 DV, AP −2",
Causapod,Caustic Spit Variant,"DV 1d10 + 3 for 3 Action Turns, kinetic armor applies, but the AV is reduced by the DV absorbed. Range 5/10/15/20",
Causapod,Exploding Variant,"Whenever the causapod takes a wound, there is a 40% chance it will explode, killing it and inflicting DV 2d10 + 4, blast area effect, resisted with energy armor.",
Chrysacid Exsurgent,Exsurgent Infection,"If a character receives a wound from contact with a chrysacid form, they become infected with the Chrynalus nanovirus (p. 174).",
Chrysacid Limb,Exsurgent Infection,"If a character receives a wound from contact with a chrysacid form, they become infected with the Chrynalus nanovirus (p. 174).",
Chrysacid Spider,Exsurgent Infection,"If a character receives a wound from contact with a chrysacid form, they become infected with the Chrynalus nanovirus (p. 174).",
Chrysacid Spur,Exsurgent Infection,"If a character receives a wound from contact with a chrysacid form, they become infected with the Chrynalus nanovirus (p. 174).",
Clown Sprite,Immunity,Clown sprites are immune to land anemone venom.,
Creeper,Femtoswarm,"Creepers follow the rules for femtoswarms (p. 170). Stats given are for a standard swarm unit, not individual femtobots.",
Creeper,Invisibility,"Can be invisible, like a nanoswarm, or materialize forms with refractive metamaterials, 
like an invisibility cloak (p. 316, EP).",
Dreadnought,Special Neural Architecture,Attempting to sleeve or mentally access the dreadnought’s cyberbrain inflicts SV 1d10.,
Extractor,Leap,Extractors can horizontally jump 4 meters (running)/2 meters (standing) and vertically jump 2 meters; +1/0.25/0.25 meters (respectively) per 10 MoS on as Freerunning Test.,
Extractor,Sedative,"Injected, Onset Time: 1 Action Turn, Duration: 1 hour. Biomorphs that fail a SOM Test are knocked unconscious and cannot be woken without stimulants; on a success they suffer −20 to all actions.",
Extractor,Stack Collector,There is a 40% chance that an extractor will be carrying 1d10 ÷ 2 cortical stacks collected from previous victims.,
Factor Ambassador,Immunity to Kinetic Damage,Factors take minimum DV from kinetic weapons and blades.,
Factor Ambassador,Implanted Plasma Grenade,"DV 3d10 + 10, AP −6, inflicts double damage to Ambassador; remaining damage is applied as normal area effect to bystanders.",
Factor Ambassador,Melding,"Factors may meld together into larger forms. Use the highest stat, +2 per additional Factor (to a maximum +10). Durability, Wound Threshold, and Death Rating are added together (to a maximum x5).",
Factor Ambassador,Regeneration,Factors regenerate 2 damage per Action Turn; wounds may not be regenerated.,
Factor Gestalt,Immunity to Kinetic Damage,Factors take minimum DV from kinetic weapons and blades.,
Factor Gestalt,Dust Cloud,"Factor gestalts are surrounded by a miasma of Factor dust, extending to a 30 meter radius. This dust impedes visibility (−20), reduces laser pulser ranges by half, and biomorphs must make a SOM x 3 Test or suffer −10 due to coughing and choking.",
Factor Gestalt,Poison Glands,"Gestalts can generate poison glands to secrete/exhale new toxins besides Factors dust, emulating the effects of other neurotoxins. Growing a new poison gland takes about 1 hour.",
Factor Gestalt,Regeneration,Gestalts regenerate 1d10 damage per Action Turn; wounds may not be regenerated.,
Factor Guardian,Immunity to Kinetic Damage,Factors take minimum DV from kinetic weapons and blades.,
Factor Guardian,Factor Exosuit,"When equipped, provides +6/+4 armor, a Movement Rate of 8/40, +20 to strength-related SOM Tests, and +2d10 DV to melee attacks. Durability 50.",
Factor Guardian,Melding,"Factors may meld together into larger forms. Use the highest stat, +2 per additional Factor (to a maximum +10). Durability, Wound Threshold, and Death Rating are added together (to a maximum x5).",
Factor Guardian,Regeneration,Factors regenerate 2 damage per Action Turn; wounds may not be regenerated.,
Factor Minikin,Immunity to Kinetic Damage,Factors take minimum DV from kinetic weapons and blades.,
Factor Minikin,Melding,"Factors may meld together into larger forms. Use the highest stat, +2 per additional Factor (to a maximum +10). Durability, Wound Threshold, and Death Rating are added together (to a maximum x5).",
Factor Minikin,Regeneration,Factors regenerate 2 damage per Action Turn; wounds may not be regenerated.,
Feral Defiler,Fear Pheremones,"Defilers emit pheromones tailored to trigger fear and flight responses in human biomorphs. Apply a +10 to Intimidation Tests when applicable. At the gamemaster’s discretion, close proximity to a defiler may provoke a WIL x 3 Test; if the human fails, they must flee for at least 2 Action Turns.",
Feral Defiler,Defiler Egg,"Victims stung by defilers are unaware they have been injected with eggs. For the first 2 days, they show no symptoms, and Medicine Tests suffer a −30 modifier to detect the parasitoids. On the third day, they suffer intense cramping and pain, taking DV 2d10 every hour as the larvae feed on their organs. This damage cannot be healed until the parasitoids are removed. Removing them is a Medicine Task Action (1 hour). There is a 30% chance that attempting to eradicate the larvae will force them to rapidly chew out and evacuate the body (inflicting DV 2d10). Otherwise the larvae eat their way out once the victim has died, consuming the corpse before scurrying off.",
Fetch,Exsurgent Infection,Fetches carry the digital exsurgent virus and will attempt to infect infomorphs and cyberbrains.,
Flesh Party,Exsurgent Infection,"Flesh parties exude the exsurgent nanovirus. Treat it as a nanoplague (p. 172) with dermal, inhalation, and injection vectors and an Infection Rating of 40.",
Flesh Party,Wound Invulnerability,Flesh parties are immune to wound effects.,
Flesh Party,Regeneration,Flesh parties regenerate 1d10 damage per hour.,
Fractal,Exsurgent Infection,Fractals are often infected and equipped with the exsurgent virus.,
Fractal,Feign Destruction,"Fractals are programmed to “fall apart” right before accumulated damage reaches their Death Rating, dissolving into numerous nanoswarms that set about rebuilding the fractal.",
Fractal,Invulnerability,Area effect and spray weapons do half damage against fractals. All other weapons do minimum damage.,
Fractal,Nanofabrication,"Fractals may be equipped with or fabricate any enhancements, gear, armor, or weapons the GM desires to present an appropriate threat. Nanofab time is half an hour per Cost category. They may also mimic the effects of nanoswarms (p. 328, EP).",
Fractal,Regeneration,"Fractals repair 1d10 damage per half hour. After all damage is fixed, fractals may repair wounds at the rate of 1 per hour.",
Fractal Troll,Exsurgent Infection,"Victims wounded by a fractal troll’s bite, claws, or fractal gouge are infected with the xenomorph plague.",
Freak,Hardwired Self-Destruct System,"This detonates if the async takes damage exceeding Durability, inflicting DV 4d10 + 5, AP −5, blast area effect.",
Gardener Insect Swarm,Swarm,"Bees and wasps use the rules given for Swarms (p. 168). Stats given are for one swarm, not individual insects.",
Gardener Insect Swarm,Assassin Variant,Add Poison Gland with toxin of GM’s choice.,
Giant Barbed Eel,Shock Invulnerability,Barbed eels are immune to shock effects.,
Guardian Brute,Intimidating,Brutes receive a +20 modifier on Intimidation Tests.,
Guardian Brute,Decoy Weapons,"Brutes are sometimes equipped or implanted with obvious but fake heavy weapons systems, such as seekers or plasma rifles. These may be spotted as fake with a Perception Test at −30.",
Guardian Brute,Bullet Magnet,Brutes are modified to soak as much damage as possible. They may ignore the effects of 2 wounds.,
Guardian Spider Head,Volatile,Any damaging hit on a spider bot has a (20 + DV inflicted)% chance of setting off the explosives it carries.,
Gut Eeater,Possession,"Forcing its way down a throat is an Opposed Test between the gut eater’s REF x 3 (60) and the victim’s SOM x 2 and inflicts DV 1d10 (armor does not apply). If successful, the gut eater burrows into the victim’s abdomen, inflicting 10 DV (no defense). Within 10 Action Turns, it extends neural filaments, linking to the host’s brain and nervous system. Once the parasite wins an Opposed WIL x 3 Test, it subverts the host’s biological mind (if it fails, it will attempt every 10 minutes with a cumulative +10 modifier as it exerts more connections and control over the host). Dominated transhumans suffer SV 2d10. Gut eaters perceive through their hosts’ senses, though they suffer −30 modifiers on the first day. Gut eaters cannot control biomorphs with cyberbrains. Over the next week, the gut eater will slowly extrude its mouth and tentacle arms through the victim’s abdomen.",
Headhunter Mk II,Onboard Fabber,Can fabricate a new seeker missile in 30 minutes.,
Hollow,Caustic Gas,"Hollows deploy caustic smoke for defense: Dermal, Onset Time: 1 Action Turn, Duration: 3 Action Turns/1 minute. This gas blocks vision and thermal within a 10-meter radius, reduces the range of laser pulsers by half, and inflicts DV 1d10 to biomorphs (no defense) per turn for 3 Action Turns. Damaged victims must make a SOM x 2 Test or be blinded for 1 minute.",
Hollow,Mimicry,"The nanoplasma may invade any creature it touches. It is slow-moving and easy to avoid (Fray Test at +20), preferring incapacitated or surprised victims. “Mapping” inflicts 1d10 DV per Action Turn (accumulated damage inflicts wounds) and is exceptionally painful; victims without Pain Tolerance are incapacitated, those without Pain Tolerance (Level Two) suffer −20 to all actions. Nanophages double the time and halve the damage. After 10 minutes, the host is disassembled and a skin suit is formed. The hollow absorbs the victim’s memories, skills, and ego traits (Kinesics Test at −30 to notice a difference). Hollows can mimic previous victims.",
Hollow,Nanoplasma Invulnerability,"Most attacks simply inflict DV 1. Area-effect, plasma, and fire attacks inflict half damage. Nanoplasma is immune to wounds. EMP has no effect.",
Hollow,Node Nucleus,"Nodes are difficult to find (Perception Test at −30). If destroyed, the hollow is irrevocably killed. Nodes have Armor 30/30 and Durability 50.",
Hollow,Regeneration,Hollow nanoplasma repairs 1d10 damage per hour.,
Hookbladder,Pain Tolerance,"In their breeding cycle, hookbladders develop a resistance to pain. They ignore the effects of 2 wounds and will not react to fire, acid, or agonizers.",
Hookbladder,Parasitic Control,"Once a hookbladder envelopes a biomorph victim’s head, it extends shoots into the victim’s orifices and through the area pierced by its hook. These tie the victim to the hookbladder’s metabolism and, in the case of transhumans, allow them to function without breathers in Teragula’s normally asphyxiating atmosphere. This will inflict DV 1d10 ÷ 2, no defense, for 3 Action Turns. If the hookbladder is not removed in 2 Action Turns, it will dominate the target’s mind. The only way to remove the hookbladder is to kill it or forcibly pull it off with an Opposed SOM x 3 Test; subdued victims suffer −30 on this test. Forced removal inflicts DV 1d10, no defense, as the hook rips free. Biomorphs saved from hookbladder infestation quickly (in less than 10 minutes) recover rapidly, but those infested longer require time in a healing vat to repair damage to their nervous system (−10 to all actions until they do).",
Hookbladder,Shock Resistance,The primitive neural systems of hookbladders are immune to shock effects.,
Hookbladder,Biomorph Preference,"Hookbladders breathe through their skin membranes. They will ignore synthmorphs and robots unless attacked. Their hook attack can still damage synthetic shells, but the parasitization only affects biomorphs.",
Hookbladder Zombie,Hookbladder Mask,"Because the parasite remains attached to the victim’s head, attempts to target it are likely to hurt the victim as well. Treat such attacks as called shots (−10 to hit); if the attacker does not succeed with an MoS of 30+, split the damage evenly between the hookbladder and zombie. ",
Hookbladder Zombie,Killing Machine,"Hookbladder zombies are pre-occupied with murder, with little regard for their own protection. They receive a +10 modifier to attack; attacks against them also receive a +10 to hit. Zombies are sometimes clever enough to use melee weapons, but are unlikely to use ranged weapons; most simply attack unarmed.",
Hookbladder Zombie,Linked Metabolism,Zombies can “breathe” underwater or in Teragula’s atmosphere.,
Hookbladder Zombie,Muses,"The hookbladder’s minuscule intelligence makes mesh inserts useless, but muses belonging to the victim are unaffected and may contact others via the mesh in search of help. Cutting down a zombie while their muse pleads for mercy inflicts SV 1d10.",
Hunter-Killer,Deflectors,"Some advanced hunter-killer models are equipped with supercapacitors embedded within their armor that release a massive charge at the area pinpointed by an attack, creating a temporary, huge, electromagnetic force field that repels or destroys incoming projectiles. This provides a −30 modifier to hit the hunter-killer, but only against kinetic weapon and seeker attacks that the hunter- killer has detected. These deflectors have 20 uses before they must be recharged, which takes 2 hours.",
Immolator Breeder,Exsurgent Infection,Breeders infect biomorphs with the glory exsurgent virus (p. 175) by exchanging bodily fluids.,
Immolator Drone,Exsurgent Infection,Drones can infect biomorphs with the glory exsurgent virus (p. 175) by exchanging bodily fluids.,
Immolator Mother,Exsurgent Infection,Mothers infect biomorphs with the glory exsurgent virus (p. 175) by exchanging bodily fluids.,
Jelly,Corrosive Coating/Spit,"Application: D, O; Onset Time: 1 Action Turn; Duration: 5 Action Turns; Effect: DV 1d10 ÷ 2 (round up) per Action Turn, armor protects but is reduced by the DV. Subdued victims suffer DV 1d10. This coating also provides immunity to nanoswarms, corrosives, and dermal-vector drugs and chemicals. Liquid-based attacks against the jelly suffer a −30 modifier. ",
Jelly,Exsurgent Infection,Jellies can infect other biomorphs with the jelly xenomorph strain by exchanging bodily fluids.,
Jelly,Invulnerability,Jellies take minimum DV from kinetic weapons and blades.,
Jelly,Lubrication,Jellies are immune to subdual attempts.,
Jelly,Vacuum Expansion,Jellies gain the Large Size trait in vacuum (+10 to hit).,
Killer Spambot,DoS Attack,"Target must be traced first (p. 258, EP). Opposed Infosec Test; if successful, target is −1 Speed and has a 10% chance of suffering a glitch (p. 144, Transhuman). See DoS Attacks, p. 147 and 149, Transhuman.",
Killer Spambot,Lockout,"Target must be zeroed in and locked first (p. 257, EP). Opposed Infosec Test with intruder at −20; if successful, target intruder is locked out of system (p. 258, EP)",
Killer Spambot,Brainhack,"Targets are inflicted with bedlam (SV 1d10) or cauterizer (DV 1d10 + 5) scorchers (p. 332, EP).",
Killer Spambot,Hidden Privileges,"Spambots have hidden intruder status (p. 256, EP) to their home server and all local devices, giving them admin rights and +30 to all subversion tests.",
Killer Spambot,Legacy System,"Many spambots rely on software that is years out of date. They suffer a −10 to −30 modifier when hacking more modern systems; however, the same modifier is applied to those attempting to hack them.",
Killer Spambot,Spam Mist,"Everyone within mesh range suffers a −30 Perception modifier due to AR spam overload. This may be cleared with an Interfacing Test at −30, but will return after 10 minutes as the spam compensates for the filtering; see Traffic Filters and Mist, p. 248, EP. Alternatively, AR may be turned off, but this will disable tacnets and hinder other gear.",
Land Anemone,Tentacle Toxin,"Dermal, Onset: 1 Action Turn, Duration: 3 Action Turns/1 hour. Inflicts DV 2d10 + 10 per turn for 3 Action Turns and paralyzes for 1 hour. A SOM x 2 Test negates the paralyzation. Medichines reduce damage by half and apply +30 modifier to test.",
Larval Defiler,Defiler Cocoon,"Larval defilers ensconce themselves in a cocoon, taking 1 week to transform into an adult. The cocoon itself offers 15/10 Armor, but the defilers inside are helpless and vulnerable during the metamorphosis (Durability 5).",
Leftover Special Snack Bar,Flesh Regeneration,Snack bars regenerate 1d10 damage or 1 wound per hour; all damage must be healed before wounds.,
Mantis Worm,Acid Plume,"Threatened swarms release a plume of acid in the water, extending 5 meters around the swarm. Anyone caught in this plume suffers DV 1d10 ÷ 2 each turn and must make a SOM x 2 Test or flee (negated by Pain Tolerance).",
Mind Wrapper,Puppeteer Psi Sleight,"Opposed with WIL x 2, Touch Range, Sustained, Strain DV (1d10 / 2) + 3. The wrapper controls the target’s mind. Every turn, victim can break free with an Opposed Test, their WIL versus wrapper’s Control skill. See p. 179.",
Mimc Jelly,Corrosive Coating/Spit,"Application: D, O; Onset Time: 1 Action Turn; Duration: 5 Action Turns; Effect: DV 1d10 ÷ 2 (round up) per Action Turn, armor protects but is reduced by the DV. Subdued victims suffer DV 1d10. This coating also provides immunity to nanoswarms, corrosives, and dermal-vector drugs and chemicals. Liquid-based attacks against the jelly suffer a −30 modifier. ",
Mimc Jelly,Exsurgent Infection,Jellies can infect other biomorphs with the jelly xenomorph strain by exchanging bodily fluids.,
Mimc Jelly,Invulnerability,Jellies take minimum DV from kinetic weapons and blades.,
Mimc Jelly,Lubrication,Jellies are immune to subdual attempts.,
Mimc Jelly,Vacuum Expansion,Jellies gain the Large Size trait in vacuum (+10 to hit).,
Mimc Jelly,Mimicry,"Mimic jellies take the form of their pre-exsurgent self or victims they engulf (+30 to Disguise Tests). Absorbing and copying a victim takes half an hour. The jelly takes on the victim’s memories, skills, and ego traits. Their gelatinous nature is immediately noticeable with t-rays or physical contact, or with an enhanced vision/radar Perception Test at −30. Characters familiar with the victim may notice oddities with an Opposed Impersonation vs. Kinesics Test. Mimic jellies may only imitate one biomorph at a time. To reset, another transhuman must be consumed",
Ny’knikiin,Ny’knikiin software,"Ny’knikiin software is radically different from transhuman designs. Attempts to use or subvert ny’knikiin gear require extensive study (timeframe: 1 week)and suffer a −30 modifier. Ny’knikiin hackers are common and have software comparable to transhuman equivalents, but are at a similar disadvantage working with transhuman systems.",
Poisonous Marmoset Swarm,Swarm,"Use the rules given for Swarms (p. 168). Stats given are for one swarm, not individual marmosets.",
Puppet Elite Agent,Basilisk Hack,"Deployed via augmented reality. See Basilisk Hacks, p. 365, EP.",
Sapient Defiler,Fear Pheremones,"Defilers emit pheromones tailored to trigger fear and flight responses in human biomorphs. Apply a +10 to Intimidation Tests when applicable. At the gamemaster’s discretion, close proximity to a defiler may provoke a WIL x 3 Test; if the human fails, they must flee for at least 2 Action Turns.",
Sapient Defiler,Defiler Egg,"Victims stung by defilers are unaware they have been injected with eggs. For the first 2 days, they show no symptoms, and Medicine Tests suffer a −30 modifier to detect the parasitoids. On the third day, they suffer intense cramping and pain, taking DV 2d10 every hour as the larvae feed on their organs. This damage cannot be healed until the parasitoids are removed. Removing them is a Medicine Task Action (1 hour). There is a 30% chance that attempting to eradicate the larvae will force them to rapidly chew out and evacuate the body (inflicting DV 2d10). Otherwise the larvae eat their way out once the victim has died, consuming the corpse before scurrying off.",
Shifter,Mimicry,"Succeeds with an Opposed Impersonation vs. Kinesics Test. The synthetic nature of mimicked biomorphs is obvious with t-rays or physical contact, or an enhanced vision/radar Perception Test at −30.",
Shifter,Shape Adjusting,"Shifters change form in half the timeframe of transhuman tech and can create complex, mechanical forms such as firearms or implants.",
Skitter,Microswarm,"Skitters follow the rules for (Swarms, p. 168). Stats given are for a standard swarm unit, not individual microbots.",
Skitter,Jam Radio,"Radios and radar suffers interference, imposing a –30 modifier on all sensor-related tests. Targets may attempt to overcome this interference by beating the skitter in an Opposed Interface Test.",
Skitter,Blinding Lasers,"Skitter swarms may deploy lasers to blind cameras much like a dazzler (p. 316, EP). 
These lasers will blind characters as well for 1 minute unless they make a REF x 3 Test. Anti-glare cyberware protects against blinding.",
Skitter,Sabotage,"DV 1d10 each Action Turn (no defense, armor applies but is reduced) to all synthmorphs and non-biological devices touched by and targeted by the swarm.",
Skrik,Bioware,"Skriks will have the same bioware as their exsurgent parent, but not cyberware or nanoware. Some skriks will have mutations such as Claws, Extra Limbs, Poison Gland, etc.",
Skrik,Swarm Tactics,"A large number of skriks (50+) will attack as a swarm. Use the rules for (Swarms, p. 168), with a Durability of 80. ",
Slouch,Self-Destruct,"Slouches carry a small plasma magnetic bottle that will detonate when they take more than 75 points of damage or if anyone attempts to open up or otherwise tamper with a disabled slouch. This explosion inflicts DV 5d10 + 16, AP −6, blast area effect, and will completely destroy the slouch.",
Slouch,Bessel Beam Turret,"This device functions like a tractor/repulsor beam. Struck targets are pushed either directly towards or away from the slouch. The distance moved depends on the target’s size: very small, 20 meters; small: 10 meters; medium: 5 meters; large: 1 meter, very large: unaffected. Struck targets are trapped by the beam and must make a SOM Test to escape its grasp or they will continue to be attracted/repelled each Action Turn. Max Range 500. These turrets have 20 turns of use and take 4 hours to recharge.",
Snapper,Armored Variant,"Heavy Armor (+16/+16), Offensive Armor Mod (shock effect; p. 204, EP), Self-Healing Armor Mod, 2 Weapon Mounts (External, Articulated) with twin Railgun Machine Guns (DV 2d10 + 8, AP −9, BF/FA, Ammo 500)",
Spambot Minion,Jamming,"Minions will attempt to jam TITAN communications and radar using universal jamming (p. 262, EP).",
Spambot Minion,Spam Mist,"Everyone within mesh range of the spambot suffers a −30 Perception Test modifier due to AR spam overload. This may be cleared with an Interfacing Test at −30, but will return after 10 minutes as the spam compensates for the filtering; see Traffic Filters and Mist, p. 248, EP. Alternatively, AR may be turned off, but this will disable tacnets and hinder other gear.",
Spambot Minion,Suicide Bot,"These bots are suicide bombers. DV 3D10 + 6, AP −4, blast area effect.",
Stalker,Infrasonic Emitter,"All biomorphs within 30 meters must make a SOM Test or be nauseated and disoriented, suffering −30 to all actions for 1 minute. This test must be taken again if exposed for more than a minute. Additionally, for each full minute a biomorph is exposed (nauseated or not), they suffer DV 1d10 + 2, no defense. This effect works through walls, ground, and water, but not vacuum.",
Stinger Hound,Camouflage,Stinger hounds that remain still and crouched under their shell receive a +30 to Infiltration Tests to hide.,
