name,Name,Description,Special Effect
Think Tank,Deflectors,"Think tanks are equipped with supercapacitors embedded within their armor that release a massive charge at the area pinpointed by an attack, creating a temporary, huge, electromagnetic force field that repels or destroys incoming projectiles. This provides a −30 modifier to hit the tank, but only against kinetic weapon and seeker attacks that the think tank has detected. These deflectors have 20 uses before they must be recharged, which takes 2 hours.",
TITAN Smart Mine,Volatile,"Smart mines that suffer a wound have a 5% chance of exploding: DV 6d10 + 12, AP −4, blast area effect.",
TITAN Smart Mine,Suicide Strike,"Inflicts exactly enough DV to cause 2 wounds (including armor). There is a 25% chance this cripples or amputates a limb; victims losing legs move at a quarter their normal movement rate until healed or repaired (pp. 208 and 327, EP).",
Transhuman Smart Mine,Volatile,"Smart mines that suffer a wound have a 20% chance of exploding: DV 1d10 + 2, AP −4, blast area effect.",
Veiled Leech,Pounce,"Veiled leeches often attack with surprise (no defense). On its next action, the leech will bite with mouth suckers, inflicting DV 1d10 ÷ 2 (no defense, round down) and injecting sucker toxin (see below). Leeches will continue to suck blood and fluids for 1d10 + 4 Action Turns, inflicting DV 3 (no defense) each turn.",
Veiled Leech,Sucker Toxin,"Injected, Onset: Immediate, Duration: 1 hour (30 minutes with medichines). Victims must make a SOM x 3 Test or fall unconscious. Those awake still suffer steep docility and lethargy; they must pass a WIL x 2 Test to take any action, and all actions suffer a −30 modifier.",
Void Crawler,Gravity Sensitivity,"In gravity higher than 0.1 g, treat void crawlers as suffering from the effects of 1 wound. In gravity higher than 0.3 g, treat this as 2 wounds and reduce their Movement Rate by half. At 0.5 g and higher, they suffer DV 2 per minute and are effectively incapacitated.",
Void Crawler,Light Sensitivity,"Void crawlers are adapted to dim light. Extremely bright lights blind them, inflicting a −10 modifier or more.",
Void Crawler,Mindlink,Void crawlers remain mindlinked when within 15 meters of one other (and to others through each other).,
Vydra,Frenzy,"If a vydra smells or tastes blood, it will enter into a murderous frenzy. Increase REF and Fray by +10, and the vydra can ignore the effects of 2 wounds. This effect lasts until the vydra has no more prey to kill in the immediate vicinity and it has gorged on its victim(s).",
Whiplash,Larger Variant,"As above, but with SOM 25, Unarmed Combat 50 (Subdual 60), Large Size trait (+10 to hit), DUR 45, WT 9, DR 68",
Whipper,Undersea Variant,"Add Swimming 40, Echolocation, Eelware, Gills, Hydrostatic Pressure Adaptation, Temperature Tolerance (Cryonic)",
Whipper,Armored Variant,"Add Carapace Armor (12/10), Medichines, Oxygen Reserve, Radiation Tolerance, Temperature Tolerance, Vacuum Sealing",
Wild Artificial Loper,Caltrop Variant,Deploys caltrops over a 5-meter radius. Characters or wheeled vehicles/bots that move through the area without spotting the caltrops (Perception Test at −30) suffer DV 1d10 + 3 (armor does not protect); vehicles must must a Pilot Test or crash.,
Wild Artificial Loper,Smuggler Variant,"Chameleon Skin, Hidden Compartment, Thermal Dampening",
Wild Artificial Loper,Caltrop Variant,"Hidden Compartment, DV 6d10 + 20, AP −4, blast area effect",
Zombie Crab,Protist Infection,"After 5 days, the victim’s temperature spikes and they lose 5 points from all aptitudes each day, down to a minimum of 5. Victims receive the Modified Behavior (Enforced: Seek Out Water) trait.",