Name,Code,Description,Book,Page
The @-list,@,"The Circle-A list for anarchists, Barsoomians, Extropians, scum, and Titanians",,
CivicNet,c,"Used by the Jovian Republic, Lunar- Lagrange Alliance, Morningstar Constellation, Planetary Consortium, and many hypercorps",,
EcoWave,e,"Used by nano-ecologists, preservationists, and reclaimers",,
Fame,f,"The seen-and-be-seen network used by socialites, artists, glitterati, and media",,
Guanxi,g,Used by the triads and numerous criminal entities,,
The Eye,i,Used by Firewall,,
RNA,r,"Research Network Affiliation, used by argonauts, technologists, scientists, and researchers",,