Name,shortname,Type,Description,Cost,Minimum,Blueprints,Source,Stats,Variance,Stat Max,mobility,speed,Skills,Armor,Augmentations,Traits,CP
Neo-Avian,,Uplifts,"Neo-avians include ravens, crows, and gray parrots uplifted to human-level intelligence. Their physical sizes are much larger than their non-uplifted cousins (to the size of a human child), with larger heads for their increased brain size. Numerous transgenic modications have been made to their wings, allowing them to retain limited flight capabilities at 1 g, but giving them a more bat-like physiology so they can bend and fold better and adding primitive digits for basic tool manipulation. Their toes are also more articulated and now accompanied with an opposable thumb. Neo-avians have adapted well to microgravity environments, and are favored for their small size and reduced resource use.",Expensive,,FALSE,EP.141,"INT:5, REF:10, DUR:20",5,"COG:25, COO:25, INT:25, REF:25, SAV:25, SOM:20, WIL:25",Winged,,,,"Basic Biomods, Basic Mesh Inserts, Cortical Stack, Wings, Ultraviolet Vision",Non-Mammalian Biochemistry,25
Neo-Beluga,,Uplifts,"Neo-belugas are the smallest of the whale uplifts, 5.5 m in length. They are white-skinned with no dorsal ridge, toothed, and can swim backwards.",Expensive,40000,FALSE,PO.142,"COO:5, INT:5, SOM:5, DUR:35",5,"COG:25, COO:25, INT:25, REF:25, SAV:25, SOM:25, WIL:25",Submarine,,Swimming 40,,"Basic Biomods, Basic Mesh Inserts, Cortical Stack, Echolocation, Enhanced Hearing, Oxygen Reserve","Non-Human Biochemistry,Large Size",45
Neo-Dolphin,,Uplifts,"The uplifted versions of various dolphin species are very similar to baseline dolphins physiologically. Thanks to the oxygen reserve implant, neo-dolphins can stay underwater for longer (Cerean dolphins have gills installed, as the subcrustal sea has no breathable atmosphere above it). Common neo-dolphin germlines lack hands or other limbs, though cybernetic arms or even bioware enhancements are not uncommon. Neo-dolphin morphs are very rare, since there are few habitats that can support them, and they are almost never found apart from aquatic environments.",Expensive,35000,FALSE,PO.143,"COO:5, INT:5, SOM:5, DUR:30",5,"COG:25, COO:25, INT:25, REF:25, SAV:25, SOM:25, WIL:25",Submarine,,,,"Basic Biomods, Basic Mesh Inserts, Cortical Stack, Echolocation, Enhanced Hearing, Oxygen Reserve",Non-Human Biochemistry,40
Neo-Gorilla,,Uplifts,"Neo-gorillas were uplifted in the same manner as the other neo-hominids and share the same characteristics, though they are not quite as adept at climbing. They stand roughly as tall as humans, though they have stronger and larger frames.",Expensive,30000,FALSE,PO.143,"INT:5, SOM:10, DUR:40",5,"COG:30, COO:30, INT:30, REF:30, SAV:30, SOM:30, WIL:30",Walker,,,,"Basic Biomods, Basic Mesh Inserts, Cortical Stack, Prehensile Feet",Non-Human Biochemistry,35
Neo-Hominid,,Uplifts,"Neo-hominids include both uplifted chimpanzees, bonobos, and orangutans. All feature enhanced intelligence and bipedal frames. They walk upright, though some are known to knuckle-walk or switch to all fours when injured or in times of stress. All are great climbers, and their prehensile feet help both with climbing and maneuvering in microgravity environments. They retain the body hair of their forebears, though it is a common cultural practice to dye, stylize, or otherwise manipulate their hair in certain communities.",Expensive,,FALSE,EP.141,"COO:5, INT:5, SOM:5, DUR:30",5,"COG:25, COO:25, INT:25, REF:25, SAV:25, SOM:25, WIL:25",Walker,,Climbing 10,,"Basic Biomods, Basic Mesh Inserts, Cortical Stack, Prehensile Feet",Non-Human Biochemistry,25
Neo-Neanderthal,Neanderthal,Uplifts,"This morph is based on fossilized Neanderthal DNA, uplifted and enhanced to transhuman equivalence. Neanderthal morphs look like muscular humans with a heavy bone structure, distinctively long skulls, heavy brow ridges, and weak chins. Pale complexions and red hair are common features.",Expensive,,FALSE,SW.162,"COG:5, INT:5, SOM:10, DUR:40",5,"COG:30, COO:30, INT:30, REF:30, SAV:30, SOM:30, WIL:30",Walker,,,,"Basic Biomods, Basic Mesh Inserts, Cortical Stack",Non-Human Biochemistry,40
Neo-Orca,,Uplifts,"Neo-orca's average length is 7 meters for males, 6 meters for females. Males also have larger and more triangular pectoral fins.",Expensive,50000,FALSE,PO.143,"COO:5, INT:5, SOM:10, DUR:40",5,"COG:30, COO:30, INT:30, REF:30, SAV:30, SOM:30, WIL:30",Submarine,,"Swimming 40,Unarmed Combat 20",,"Basic Biomods, Basic Mesh Inserts, Cortical Stack, Echolocation, Enhanced Hearing, Oxygen Reserve","Non-Human Biochemistry,Large Size",30
Neo-Pig,,Uplifts,Neo-pigs are bipedal and feature transgenic vocal systems. They tend to be shorter but stockier than average. Males grow tusks from their lower jaws.,Expensive,,FALSE,PO.143,"SOM:5, DUR:35",5,"COG:25, COO:25, INT:25, REF:25, SAV:25, SOM:25, WIL:25",Walker,,,,"Basic Biomods, Basic Mesh Inserts, Cortical Stack",Non-Human Biochemistry,35
Neo-Porpoise,,Uplifts,Neo-porpoises are smaller but very similar to neodolphins and similarly are much like their baseline relatives. They average 2.5 m in length.,Expensive,30000,FALSE,PO.143,"INT:5, SOM:5, DUR:25",5,"COG:25, COO:25, INT:25, REF:25, SAV:25, SOM:25, WIL:25",Submarine,,Swimming 50,,"Basic Biomods, Basic Mesh Inserts, Cortical Stack, Echolocation, Enhanced Hearing, Oxygen Reserve",Non-Human Biochemistry,35
Neo-Whale,,Uplifts,"Less than several hundred neo-whale morphs exist, and the majority remain occupied by their original egos. They are primarily found in Ceres and Atlantica. They are derived from humpback, blue, and sperm whale genetic stock. Humpbacks and blues are baleen whales and require large amounts of krill to survive. Sperm whales are toothed, feeding on fish and squid.",Expensive,75000,FALSE,PO.143,"COO:5, INT:5, SOM:5, DUR:100",5,"COG:30, COO:30, INT:30, REF:30, SAV:30, SOM:30, WIL:30",Submarine,,Swimming 40,,"Basic Biomods, Basic Mesh Inserts, Cortical Stack, Echolocation, Enhanced Hearing, Oxygen Reserve","Non-Human Biochemistry,Very Large Size",75
Neotenic,,Biomorphs,"Neotenics are transhumans modified to retain a child-like form. They are smaller, more agile, inquisitive, and less resource-depleting, making them ideal for habitat living and spacecraft. Some people find neotenic sleeves distasteful, especially when employed in certain media and sex work capacities.",Expensive,,FALSE,EP.141,"COO:5, INT:5, REF:5, DUR:30",5,"COG:30, COO:30, INT:30, REF:30, SAV:30, SOM:20, WIL:30",Walker,,,,"Basic Biomods, Basic Mesh Inserts, Cortical Stack","Small Size,Social Stigma:Neotenic",25
Nomad,,Biomorphs,"While synthmorphs are the first choice for many gatecrashers, morph designers have made great headway in creating biomorphs suitable for hazardous exoplanets. The nomad biomorph is optimized for operating in desert environments and takes many of its traits from the camel, prompting some observers to mistake the nomad for a pod morph. With an elongated face designed like a camel to trap water vapor in the nostrils as the morph exhales, nomads are clearly off-putting to many bioconservatives. Some models also have camel feet for better travels in sandy dune environments. Nomads are actually quite hefty under normal circumstances, as they are designed to be able to carry large amounts of fat tissue. Their fat tissue can be moved around their body to adapt to high or low temperatures. When nomads are in the field, however, they can become quite skinny, as they survive for months on their fat tissue alone.",Expensive,,FALSE,TH.194,"COO:5, REF:5, SOM:10, DUR:40",5,"COG:30, COO:30, INT:30, REF:30, SAV:30, SOM:30, WIL:30",Walker,,,,"Basic Biomods, Basic Mesh Inserts, Cortical Stack, Efficient Digestion, Enhanced Respiration, Fat Storage, Medichines, Respirocytes, Temperature Tolerance (Cold), Toxin Filters",Uncanny Valley,30
Novacrab,,Pods,"Novacrabs are a pod design bioengineered from coconut crab and spider crab stock and grown to a human size. Novacrabs are ideal for hazardous work environments as well as vacworker, police, or bodyguard duties, given their ten 2-meter long legs, massive claws, and chitinous armor. They climb and handle microgravity well and can withstand a wide range of atmospheric pressure from vacuum to deep sea. Novacrabs feature compound eyes, gills, dexterous manipulatory digits on their fifth set of limbs, and transgenic vocal cords.",Expensive,,FALSE,EP.142,"SOM:10, DUR:40","5,5","COG:30, COO:30, INT:30, REF:30, SAV:30, SOM:30, WIL:30",Walker,,,,"Basic Biomods, Basic Mesh Inserts, Cortical Stack, Cyberbrain, Carapace  Enhanced Respiration, Gills, Mnemonic Augmentation, Oxygen Reserve, Puppet Sock, Temperature Tolerance, Vacuum Sealing",Non-Mammalian Biochemistry,60
Observer,,Biomorphs,"Observers have their minds enhanced to bolster intuitive, analytical, and investigative capabilities. They are favored by detectives and others with a mind towards details, puzzles, and thin-slicing.",Expensive,,FALSE,TH.194,"COG:5, INT:10, REF:5, DUR:35",5,"COG:30, COO:30, INT:30, REF:30, SAV:30, SOM:30, WIL:30",Walker,,,,"Basic Biomods, Basic Mesh Inserts, Cortical Stack",,40
Octomorph,,Uplifts,"These uplifted octopi sleeves have proven quite useful in zero-gravity environments. They retain eight arms, their chameleon ability to change skin color, ink sacs, and a sharp beak. They also have increased brain mass and longevity, can breathe both air and water, and lack a skeletal structure so they can squeeze through tight spaces. Octomorphs typically crawl along in zero gravity using their arm suckers and expelling air for propulsion and can even walk on two of their arms in low gravity. Their eyes have been enhanced with color vision, provide a 360-degree  eld of vision, and rotationally adjust to keep the slit-shaped pupil aligned with “up.” A transgenic vocal system allows them to speak.",Expensive,30000,FALSE,EP.141,"COO:5, INT:5, DUR:30",5,"COG:30, COO:30, INT:30, REF:30, SAV:30, SOM:30, WIL:30",Walker,,"Climbing 10,Swimming 30",,"Basic Biomods, Basic Mesh Inserts, Cortical Stack, Chameleon Skin, 360-Degree Vision, Polarization Vision","Non-Mammalian Biochemistry,Limber (Level 2)",50
Olympian,,Biomorphs,"Olympians are human upgrades with improved athletic capabilities like endurance, eye-hand coordination, and cardiovascular functions. Olympians are common among athletes, dancers, freerunners, and soldiers.",Expensive,,FALSE,EP.140,"COO:5, REF:5, SOM:10, DUR:40",5,"COG:30, COO:30, INT:30, REF:30, SAV:30, SOM:30, WIL:30",Walker,,,,"Basic Biomods, Basic Mesh Inserts, Cortical Stack",,40
Opteryx,,Synthmorphs,"This recon morph is designed to be a fast, lightweight runner, climber, and flyer. The opteryx looks like a one-meter-tall winged, synthetic dinosaur and adopts an almost horizontal body posture when running, its tail held out for balance. Its wings are fully functional arms equipped with claws. This morph is a favorite for gatecrashers and neo-avians in the dinosaur identity subculture. It comes equipped with cartography package (p. 199) software.",Expensive,40000,FALSE,TH.194,"COO:5, INT:5, REF:5, DUR:25",,"COG:30, COO:30, INT:30, REF:30, SAV:30, SOM:25, WIL:30",Winged,,"Climbing 10,Flight 10",2/2,"Access Jacks, Basic Mesh Inserts, Claws, Cortical Stack, Cyberbrain, Enhanced Vision, Grip Pads, Mnemonic Augmentation, Pneumatic Limbs, Prehensile Tail",Small Size,40
Picklock,,Flexbots,Picklocks are an excellent complement to a rogue module. They are illegal or restricted in many habitats.,Expensive,,FALSE,TH.202,"INT:5, DUR:20",,"COG:30, COO:30, INT:30, REF:30, SAV:30, SOM:25, WIL:30",Walker,,,4/4,"Access Jacks, Basic Mesh Inserts, Chameleon Skin, Cortical Stack, Cyberbrain, Grip Pads, Hidden Compartment, Mnemonic Augmentation, Modular Design, Radar Absorbent, Shape Adjusting, Wrist-Mounted Tools, Hopper",Small Size,20
Pleasure Pod,,Pods,"Pleasure pods are exactly what they seem—faux humans designed purely for intimate entertainment purposes. Pleasure pods have extra nerve clusters in their erogenous zones, Fine motor control over certain muscle groups, enhanced pheromones, sanitized metabolisms, and the genetics for purring. Naturally, they are crafted for good looks and charisma and enhanced in other areas as well. Pleasure pods are capable of switching their sex at will to male, female, hermaphrodite, neuter, or other intersex variations.",High,,FALSE,EP.142,"INT:5, SAV:5, DUR:30",5,"COG:30, COO:30, INT:30, REF:30, SAV:30, SOM:30, WIL:30",Walker,,,,"Basic Biomods, Basic Mesh Inserts, Cortical Stack, Cyberbrain, Clean Metabolism, Enhanced Pheromones, Mnemonic Augmentation, Puppet Sock, Sex Switch",Social Stigma:Pleasure Pod,20
Premium Ruster,,Biomorphs,"Rusters are adapted for survival in the Martian environment, these morphs are free from the Planned Obsolescence that has been imposed on Regular Ruster models.",Expensive,,FALSE,EP.141,"SOM:5, DUR:35",5,"COG:25, COO:25, INT:25, REF:25, SAV:25, SOM:25, WIL:25",Walker,,,,"Basic Biomods, Basic Mesh Inserts, Cortical Stack, Enhanced Respiration, Temperature Tolerance",,25
Q-Morph,,Synthmorphs,"Quartz morphs, commonly called Q-morphs, are the primary shell design used for Venusian surface mining. Constructed from quartz and extremely durable alloys, Q-morphs look like four-legged crabs with two pairs of arms. The lower pair of arms is designed for strength, the upper pair for precision and dexterity. This morph is squat, exceptionally tough, and completely unable to function in temperatures below 250 C.",Expensive,60000,FALSE,SW.163,"COO:15, SOM:10, DUR:70",5,"COG:30, COO:40, INT:30, REF:30, SAV:30, SOM:30, WIL:30",Walker,,,18/18,"Access Jacks, Basic Mesh Inserts, Cortical Stack, Cyberbrain, Direction Sense, Echolocation, Enhanced Vision, Extreme Heat Shielding, Extreme Pressure Adaptation, Mnemonic Augmentation, Radar System, T-Ray Emitter, Wrist-Mounted Tools, Puppet Sock","Large Size,High-Temperature Operation",100
Reaper,,Synthmorphs,"The reaper is a common combat bot, used in place of biomorph soldiers and typically operated via teleoperation or by autonomous AI. The reaper’s core form is an armored disc, so that it can turn and present a thin pro le to an enemy. It uses vector-thrust nozzles to maneuver in microgravity and also takes advantage of an ionic drive for fast movement over distance. Four legs/manipulating arms and four weapon pods are folded inside its frame. The reaper’s shell is made of smart materials, allowing these limbs and weapon mounts to extrude in any direction desired and even to change shape and length. In gravity environments, the reaper walks or hops on two or four of these limbs. Reapers are infamous due to numerous war XPs, and bringing one into most habitats will undoubtedly raise eyebrows if not get you arrested.",Expensive,50000,FALSE,EP.144,"COO:5, REF:10, SOM:10, DUR:50",,"COG:40, COO:40, INT:40, REF:40, SAV:40, SOM:40, WIL:40",Thrust Vector,,,16/16,"Access Jacks, Basic Mesh Inserts, Cortical Stack, Cyberbrain, Enhanced Vision, Mnemonic Augmentation, 360-Degree Vision, Anti-Glare, Cyberclaws, Magnetic System, Pneumatic Limbs, Puppet Sock, Radar System, Reflex Booster, Shape Adjusting, Structural Enhancement, T-Ray Emitter, Weapon Mount: Articulated, Hopper, Ionic, Walker, Heavy Combat Armor",,100
Remade,,Biomorphs,"The remade are completely redesigned humans: humans 2.0. Their cardiovascular systems are stronger, the digestive tract has been sanitized and restructured to eliminate flaws, and they have otherwise been optimized for good health, smarts, and longevity with numerous transgenic mods. The remade are popular with the ultimates faction. The remade look close to human, but are different in very noticeable and sometimes eerie ways: taller, lack of hair, slightly larger craniums, wider eyes, smaller noses, smaller teeth, and elongated digits.",Expensive,40000,FALSE,EP.141,"COG:10, SAV:5, SOM:10, DUR:40","5,5","COG:40, COO:40, INT:40, REF:40, SAV:40, SOM:40, WIL:40",Walker,,,,"Basic Biomods, Basic Mesh Inserts, Cortical Stack, Circadian Regulation, Clean Metabolism, Eidetic Memory, Enhanced Respiration, Temperature Tolerance, Toxin Filters",Uncanny Valley,60
Ring Flyer,,Biomorphs,"Designed for use in Saturn's magnetic field, this exotic biomorph is also occasionally used around Jupiter, Uranus, and Neptune, as well as having limited use in the Jovian Trojans and Main Belt. Easily recognizable with its slender limbs and round-backed torso, this morph can survive indefinitely in space, acquiring oxygen, water, and trace organic materials from the particles of Saturn's rings. It can also maneuver around any planet with a magnetic field, flying swiftly and easily in any of these environments.",Expensive,40000,FALSE,RW.187,"COG:5, COO:5, REF:5, DUR:30",5,"COG:30, COO:30, INT:30, REF:30, SAV:30, SOM:30, WIL:30",Gas Jet System,,,,"Basic Biomods, Basic Mesh Inserts, Bioweave Armor: Light, Cortical Stack, Enhanced Respiration, Enhanced Vision, Grip Pads, Hibernation, Long Term Life Support, Medichines, Oxygen Reserve, Plasma Sail Implant, Prehensile Feet, Radiation Tolerance, Temperature Tolerance (Cryonic), Vacuum Sealing",Limber (Level 1),70
Ripwing,,Pods,"Developed by the genehackers of Fortean, ripwings are neogenetic avians, incorporating genetics from a range of flying creatures, some of them prehistoric pterosaur genes acquired from Sky Ark researchers, along with some original genetic traits. These transgenic amalgamations are larger and sturdier than standard neo-avian morphs. They are popular among both neo-avian mercurials who want a more robust form and gatecrashers looking for a quick and stealthy flyer for recon missions. The ripwing morph makes more extensive use of the chiroptera genestocks used to give the first avian uplifts functional hands. Instead of feathers, ripwings feature tough leathery skin or even scales. The morphs are usually a uniform matte black in color, though they are able to change color at will due to their chameleon skin enhancements.",Expensive,30000,FALSE,GC.151,"COO:5, INT:5, REF:5, DUR:35",,"COG:30, COO:30, INT:30, REF:30, SAV:30, SOM:30, WIL:30",Winged,,,,"Access Jacks, Basic Biomods, Basic Mesh Inserts, Chameleon Skin, Cortical Stack, Cyberbrain, Enhanced Vision, Mnemonic Augmentation, Prehensile Feet, Puppet Sock, Wings","Social Stigma:Pod,Non-Mammalian Biochemistry",40
Rogue,,Flexbots,Rogue modules are optimized for stealth and infiltration. They are illegal or restricted in many habitats.,Expensive,35000,FALSE,TH.203,"COO:5, REF:5, DUR:35",,"COG:30, COO:30, INT:30, REF:30, SAV:30, SOM:25, WIL:30",Walker,,,6/6,"Access Jacks, Basic Mesh Inserts, Chameleon Skin, Cortical Stack, Cyberbrain, Enhanced Vision, Fractal Digits, Mnemonic Augmentation, Modular Design, Nanoscopic Vision, Radar Absorbent, Shape Adjusting, T-Ray Emitter, Weapon Mount: Articulated, Hopper","Tough (Level 1),Small Size",35
Rover,,Synthmorphs,"Rover morphs are a smaller, defense-oriented version of the sphere morph. Each rover is 0.6 meters in diameter and, with its limbs retracted, has the ominous appearance of a reflective, shiny, black globe. It can extrude three arms, each with a built-in weapon: extendable claws, a small laser, and a heavy rail pistol loaded with 200 rounds of ammunition. Rovers are stealthy and highly maneuverable and so favored for bodyguard and police purposes in some areas. They are often deployed via remote control.",Expensive,60000,FALSE,TH.194,"COO:5, INT:5, REF:5, DUR:25",5,"COG:30, COO:30, INT:30, REF:30, SAV:30, SOM:30, WIL:30",Thrust Vector,,,10/10,"360-Degree Vision, Access Jacks, Basic Mesh Inserts, Chameleon Skin, Cyberclaws, Cortical Stack, Cyberbrain, Enhanced Vision, Gas Jet System, Hand Laser, Mnemonic Augmentation, Neurachem (Level 1), Puppet Sock, Radar Absorbent, Reduced Signature, T-Ray Emitter, Telescoping Limbs, Weapon Mount: Articulated, Roller",Small Size,60
Rover: Space Fighter,Space Fighter,Synthmorphs,"This version of the rover is fitted with a miniature metallic-hydrogen rocket with an acceleration up to 0.25 g, so that it is useful in short-range space battles. Several of these morphs can be launched from a spaceship to attack another ship or a habitat.",Expensive,60000,FALSE,TH.194,"COO:5, INT:5, REF:5, DUR:25",5,"COG:30, COO:30, INT:30, REF:30, SAV:30, SOM:30, WIL:30",Thrust Vector,,,10/10,"360-Degree Vision, Access Jacks, Basic Mesh Inserts, Chameleon Skin, Cyberclaws, Cortical Stack, Cyberbrain, Enhanced Vision, Gas Jet System, Hand Laser, Mnemonic Augmentation, Neurachem (Level 1), Puppet Sock, Radar Absorbent, Reduced Signature, T-Ray Emitter, Telescoping Limbs, Weapon Mount: Articulated, Roller, Internal Rocket",Small Size,60
Ruster,,Biomorphs,"Adapted for survival with minimum gear in the not-yet-terraformed Martian environment, these transgenic morphs feature insulated skin for more effective thermoregulation and respiratory system improvements to require less oxygen and filter carbon dioxyde, among other mods. Many rusters come with the Planned Obsolescence trait.",High,,FALSE,EP.141,"SOM:5, DUR:35",5,"COG:25, COO:25, INT:25, REF:25, SAV:25, SOM:25, WIL:25",Walker,,,,"Basic Biomods, Basic Mesh Inserts, Cortical Stack, Enhanced Respiration, Temperature Tolerance",Planned Obsolescence,20
Ruster,,Biomorphs,"Adapted for survival with minimum gear in the not-yet-terraformed Martian environment, these transgenic morphs feature insulated skin for more effective thermoregulation and respiratory system improvements to require less oxygen and  lter carbon dioxyde, among other mods. Many rusters come with the Planned Obsolescence trait, as noted on p. 166, Sunward.",Expensive,,FALSE,,"SOM:5, DUR:35",5,"COG:25, COO:25, INT:25, REF:25, SAV:25, SOM:25, WIL:25",Walker,,,,"Basic Biomods, Basic Mesh Inserts, Cortical Stack, Enhanced Respiration, Temperature Tolerance",,25
Sage,,Eidelons,"This cutting-edge eidolon is too new to have seen widespread adoption by scientists and academics, but its popularity is spreading among intellectuals, researchers, and others who can afford it.",Expensive,40000,FALSE,TH.142,"COG:10, SPD:2",5,"COG:40, COO:40, INT:40, REF:40, SAV:40, SOM:40, WIL:40",,,,,"Eidetic Memory, Hyper Linguist, Math Boost, Mnemonic Augmentation",,40
Salamander,,Biomorphs,"Salamanders are a type of biomorph popular with Solarians. They share some of the physiological traits of suryas, but are unable to survive unpro- tected in the corona (requiring a solar survival suit, like other biomorphs), and are instead bio-engineered to survive in the protected vacuum of coronal habitats. Their skin is thick, hairless, vaguely reptilian, and mostly black in color, with gold and orange body patterning. Like suryas, salamanders communicate either via wireless transmissions or by “sunspotting”—using their chromatophores to shift light and dark patterns on their skin to form patterns easily comprehensible to other coronal morphs. Salamanders have a wiry, streamlined, swept-back sort of look, a combination of fey and monkey-like. Their heads are also somewhat reptilian, with re ective eyes, no nose, and no mouth. Their feet are prehensile, usable just like hands. They lack reproductive organs and capabilities and feature cyberware gas jets on their chest and back for maneuvering in zero g. Many Solarians who normally inhabit suryas will sleeve into salamanders if they need to use humanoid tools or interact with non-Solarians.",Expensive,,FALSE,SW.163,"COO:5, INT:5, DUR:60",5,"COG:30, COO:30, INT:30, REF:30, SAV:30, SOM:30, WIL:30",Gas Jet System,,,,"Basic Biomods, Basic Mesh Inserts, Cortical Stack, Chameleon Skin, Enhanced Vision, Medichines, Oxygen Reserve, Prehensile Feet, Vacuum Sealing","Non-Mammalian Biochemistry,Limber (Level 1),Coronal Adaptation",40
Samsa,,Pods,"The samsa was the first attempt to create a combat pod model with a terrifying appearance. The samsa is an intimidating, two-meter-tall, four-armed, fourlegged, humanoid insect. Samsas are an unsettling sight to many transhumans. They are most commonly used by mercenaries and enforcers in the rim. Their armored carapace provides protection and the extra limbs allow a character to dual wield rifles or other two-handed weapons.",Expensive,60000,FALSE,TH.195,"COO:5, REF:5, SOM:5, DUR:45",5,"COG:30, COO:30, INT:30, REF:30, SAV:30, SOM:30, WIL:30",Walker,,Intimidation 20,,"360-Degree Vision, Basic Biomods, Basic Mesh Inserts, Carapace  Chameleon Skin, Cortical Stack, Cyberbrain, Cyberclaws, Enhanced Vision, Grip Pads, Hardened Skeleton, Mnemonic Augmentation, Neurachem (Level 1), Puppet Sock, Temperature Tolerance","Social Stigma:Pod,Unattractive (Level 2),",60
Sapper,,Flexbots,Sappers are an engineering module specializing in deconstruction; they are often combined with crafter modules.,Expensive,,FALSE,TH.203,DUR:20,,"COG:30, COO:30, INT:30, REF:30, SAV:30, SOM:25, WIL:30",Walker,,,4/4,"Access Jacks, Basic Mesh Inserts, Cortical Stack, Cyberbrain, Mnemonic Augmentation, Modular Design, Pneumatic Limbs, Shape Adjusting, Hovercraft",Small Size,15
Savant,,Synthmorphs,"This morph was developed on Ilmarinen as proof that synthmorphs can also be useful to scientists and engineers. This strangely elegant morph lacks the disturbing mimicry of humanity found in synth and steel morphs. Instead, the ovoid head with its elegantly minimalist face looks more like an artistic sculpture than a metal version of a real human head.",Expensive,40000,FALSE,RW.187,"COG:10, INT:5, SAV:5, SOM:5, DUR:40",5,"COG:40, COO:30, INT:40, REF:30, SAV:30, SOM:30, WIL:30",Walker,,,8/8,"Access Jacks, Basic Mesh Inserts, Cortical Stack, Cyberbrain, Eidetic Memory, Hyper Linguist, Math Boost, Mnemonic Augmentation, Puppet Sock",,65
