Name,shortname,Type,Description,Cost,Minimum,Blueprints,Source,Stats,Variance,Stat Max,mobility,speed,Skills,Armor,Augmentations,Traits,CP
Scholar,,Eidelons,Most voluntary infomorphs value intelligence above physical prowess and so this is one of the most popular eidolons. It is a simple and relatively powerful eidolon which has no frills and is affordable by most well-off infomorphs.,Expensive,35000,FALSE,TH.142,"COG:5, INT:5, SPD:2",,"COG:40, COO:40, INT:40, REF:40, SAV:40, SOM:40, WIL:40",,,,,"Eidetic Memory, Mnemonic Augmentation",,35
Scurrier,,Pods,"Scurriers are pods developed from the non-sapient extraterrestrials known as sciurids (p. 172, Gatecrashing). In appearance, scurrier pods are similar to raccoon-sized  flying squirrels with a lash-like manipulator rather than a fluffy tail, though still regarded as highly cute. They make excellent climbers and are capable of gliding due to the membrane between their limbs. Scurriers are gaining popularity for their usefulness in exploring tunnels and small areas as well as high areas reached by climbing. They have also been used for maintenance and tech works tasks due to their nimbleness and manual dexterity.",Expensive,,FALSE,GC.151,"COO:10, SAV:5, DUR:30",,"COG:25, COO:25, INT:25, REF:25, SAV:25, SOM:25, WIL:25",Walker,,"Climbing 10,Freerunning 10",,"Access Jacks, Basic Biomods, Basic Mesh Inserts, Cortical Stack, Cyberbrain, Gliding Membrane, Mnemonic Augmentation, Prehensile Tail, Puppet Sock","Small Size,Social Stigma:Pod,Alien Biochemistry",40
Security Pod,,Pods,"Originally developed for joint-nation peace-keeping missions and border/enclave security roles, security pods were essentially mass-produced AI-operated soldiers. For obvious reasons, they fell out of favor during the Fall, but they are slowly regaining acceptance. They are a favored morph by mercenaries for infiltration and guerrilla warfare purposes.",Expensive,,FALSE,TH.195,"SOM:10, DUR:35",5,"COG:30, COO:30, INT:30, REF:30, SAV:30, SOM:30, WIL:30",Walker,,,,"Adrenal Boost, Basic Biomods, Basic Mesh Inserts, Bioweave Armor: Light, Claws, Cortical Stack, Cyberbrain, Eelware, Enhanced Vision, Grip Pads, Mnemonic Augmentation, Puppet Sock, T-Ray Emitter",,30
Security Pod: Space Marine,Space Marine,Pods,"The space marine variant of the security pod was optimized for orbital skirmishes, boarding actions, suppressing asteroid miner revolts, and other spacetheater operations.",Expensive,,FALSE,TH.195,"SOM:10, DUR:35",5,"COG:30, COO:30, INT:30, REF:30, SAV:30, SOM:30, WIL:30",Walker,,,,"Adrenal Boost, Basic Biomods, Basic Mesh Inserts, Bioweave Armor: Light, Claws, Cortical Stack, Cyberbrain, Eelware, Enhanced Vision, Grip Pads, Mnemonic Augmentation, Puppet Sock, T-Ray Emitter, Oxygen Reserve, Prehensile Feet, Vacuum Sealing",,30
Selkie,,Biomorphs,"Selkies look like a human-seal hybrid, and in fact their genetics are aquanaut with heavy splices of seal traits. Their arms are standard human-shaped, but their legs are fused into a pair of hind flippers for powerful swimming. On land, they can stand but have difficulty moving, as they must flop, roll, or hop like a seal. They are adapted for the lack of air, deep cold, and crushing pressure of subcrustal seas.",Expensive,,FALSE,RW.187,"COO:5, SOM:10, DUR:40",5,"COG:30, COO:30, INT:30, REF:30, SAV:30, SOM:30, WIL:30",Submarine,,Swimming 10,,"Basic Biomods, Basic Mesh Inserts, Cortical Stack, Echolocation, Enhanced Hearing, Enhanced Vision, Enhanced Respiration, Gills, Hydrostatic Pressure Adaptation, Swim Bladder, Temperature Tolerance (Cold), Toxin Filters",Non-Human Biochemistry,55
Shaper,,Pods,"Shapers are the ultimate disguise morph. Constructed as pods, the default shaper look is intentionally generic, based on the computer-generated composite average look of the solar system’s residents. They lack the distinctive seam lines applied to most pod morph designs. The skin ex system allows the morph to quickly change its outward appearance. Additional modifications help the morph evade or fool sensor and biometric systems. Shapers are a favorite tool for spies and are excellent for infiltration or fooling surveillance. They are often remotely operated via puppet sock. Shapers are illegal in many habitats.",Expensive,40000,FALSE,PO.144,"INT:5, SAV:5, DUR:30",5,"COG:30, COO:30, INT:30, REF:30, SAV:30, SOM:30, WIL:30",Walker,,,,"Basic Biomods, Basic Mesh Inserts, Chameleon Skin, Clean Metabolism, Cortical Stack, Cyberbrain, Emotional Dampers, Gait Masking, Mnemonic Augmentation, Nanotat ID Flux, Puppet Sock, Sex Switch, Skinflex",,45
Skulker,,Synthmorphs,Skulkers are a stealth swarmanoid designed to infiltrate sensitive areas and avoid detection by sensors. Skulkers are illegal in many habitats.,Expensive,30000,FALSE,PO.144,DUR:20,,"COG:30, COO:30, INT:30, REF:30, SAV:30, SOM:30, WIL:30",Rotorcraft,,,,"Access Jacks, Basic Mesh Inserts, Chameleon Skin, Cortical Stack, Cyberbrain, Mnemonic Augmentation, Radar Invisibility, Walker, Hopper",Swarm Composition,35
Slave,,Eidelons,No one other than a handful of bizarre eccentrics voluntarily uses this eidolon. It is specifically designed as a means to control infomorphs who are being used as slaves. One common use of this eidolon is sending an infomorph on a mission where the sender wishes to insure the infomorphs complete and total obedience.,Moderate,,FALSE,TH.142,"WIL:-10, SPD:2",,"COG:40, COO:40, INT:40, REF:40, SAV:40, SOM:40, WIL:40",,,,,"Copylock, Mnemonic Augmentation",,5
Slitheroid,,Synthmorphs,"Slitheroid bots are synthetic shells taking the form of a 2-meter-long segmented metallic snake, with two retractable arms for tool use. Snake bots can coil, twist, and roll their bodies into a ball or hoop, moving either by slithering, burrowing, rolling, or pulling themselves along by their arms. The sensor suite and control computer are housed in the head.",Expensive,,FALSE,EP.144,"COO:5, SOM:5, DUR:45",5,"COG:30, COO:30, INT:30, REF:30, SAV:30, SOM:30, WIL:30",Snake,,,8/8,"Access Jacks, Basic Mesh Inserts, Cortical Stack, Cyberbrain, Mnemonic Augmentation, Enhanced Vision, Puppet Sock",,40
Smart Swarm,,Synthmorphs,"The smart swarm is a robust attempt to get more utility out of the swarmanoid morph design. It makes use of larger modular minidrones (rather than microdrones) that can lock together into various shapes, enabling limited physical actions and tool use.",Expensive,30000,FALSE,TH.196,DUR:15,,"COG:30, COO:30, INT:30, REF:30, SAV:30, SOM:30, WIL:30",Rotorcraft,,,,"360-Degree Vision, Access Jacks, Basic Mesh Inserts, Cortical Stack, Cyberbrain, Mnemonic Augmentation, Modular Design, Smart Swarm, Walker, Hopper","Swarm Composition, Modular Design",30
Spare,,Synthmorphs,"Spare morphs are small, cheap, lightweight, synthetic shells designed to be used as a replacement should someone’s original morph be killed or destroyed. A cortical stack (retrieved from the character’s previous morph; see p. 268, EP) can be easily plugged into the spare morph, effectively resleeving them (they must make Integration, Alienation, and Continuity Tests as normal; see pp. 270-272, EP). Once plugged in, it takes only 3 Action Turns for the cortical stack’s data to be read and checked for integrity and the ego to run inside the spare’s cyberbrain.

Spares are designed for portability. Packed as a  at disc 15 centimeters in diameter and with a mass of 2 kilograms, when activated they pop into a spherical shape with 6 slender and retractable 20-centimeter limbs (3 arms and 3 legs). They are a common piece of equipment for gatecrashing teams.",Moderate,,TRUE,GC.151,DUR:15,,"COG:20, COO:20, INT:20, REF:20, SAV:20, SOM:20, WIL:20",Walker,,,2/2,"Access Jacks, Basic Mesh Inserts, Cyberbrain, Grip Pads, Mnemonic Augmentation, Puppet Sock","Social Stigma:Clanking Masses,Small Size",5
Specialist Pod,,Pods,"Designed specifically to compete with popular mid-range morphs like the menton and olympian, the specialist pod is cheaper and faster to create than a biomorph. It also offers the user a high degree of customization.",High,,FALSE,TH.196,DUR:35,"5,10","COG:30, COO:30, INT:30, REF:30, SAV:30, SOM:30, WIL:30",Walker,,,,"Access Jacks, Basic Biomods, Basic Mesh Inserts, Cortical Stack, Cyberbrain, Mnemonic Augmentation, Puppet Sock",Social Stigma:Pod,25
Sphere,,Synthmorphs,"Popular with AGIs and synthmorph activists, this morph is a sphere approximately one meter in diameter. It can extend up to four flexible limbs as required, and typically hovers at approximately human eye level. The first tests of this morph revealed that the chameleon surface was necessary because it allows the user to display the image of a face, which made most transhumans both more comfortable talking with this morph and less likely to assume that it is a robot.",Expensive,70000,FALSE,TH.196,DUR:135,"5,5,5","COG:30, COO:30, INT:30, REF:30, SAV:30, SOM:30, WIL:30",Gas Jet System,,,6/6,"360-Degree Vision, Access Jacks, Basic Mesh Inserts, Chameleon Skin, Cortical Stack, Cyberbrain, Enhanced Vision, Mnemonic Augmentation, Puppet Sock, Telescoping Limbs, Roller, Thrust Vector",,65
Splicer,,Biomorphs,"Splicers are genefixed humans. Their genome has been cleansed of hereditary diseases and optimized for looks and health, but has not otherwise been substantially upgraded. Splicers make up the majority of transhumanity.",High,,FALSE,EP.139,DUR:30,5,"COG:25, COO:25, INT:25, REF:25, SAV:25, SOM:25, WIL:25",Walker,,,,"Basic Biomods, Basic Mesh Inserts, Cortical Stack",,10
Steel,,Synthmorphs,"This morph was developed by technicians and designers who are members of the Lunar synthmorph rights movement, the Steel Liberators. Middle-class Lunars who came out of poverty and continue to actively support the Steel Liberators sometimes choose this morph, despite the fact that this choice often results in them experiencing significant prejudice from biochauvinists.",Expensive,30000,FALSE,SW.163,"COG:5, SOM:10, DUR:40","5,5","COG:30, COO:30, INT:30, REF:30, SAV:30, SOM:30, WIL:30",Walker,,,8/8,"Access Jacks, Basic Mesh Inserts, Cortical Stack, Cyberbrain, Eidectic Memory, Mnemonic Augmentation, Puppet Sock","Uncanny Valley,Social Stigma:Clanking Masses",50
Sundiver,,Synthmorphs,"The sundiver is a synthetic morph designed for solar research and emergency rescue operations. Sundivers are sleek mechanisms, about six meters long. They look a little like ramjets, except for a pair of articulated arms that extend forward from the morph’s pointed nose, allowing it to reach for and grasp objects. Because sundivers operate in the coronal environment, they are built to survive superheated plasma and shielded against radiation. Sundivers are equipped with a powerful electromagnetic propulsion system that allows them to skate along solar magnetic lines of force much like the surya do.",Expensive,40000,FALSE,SW.164,"COO:5, REF:10, DUR:120",,"COG:30, COO:30, INT:30, REF:30, SAV:30, SOM:30, WIL:30",Thrust Vector,,,16/16,"360-Degree Vision, Access Jacks, Basic Mesh Inserts, Cortical Stack, Cyberbrain, Enhanced Vision, Mnemonic Augmentation, Radar System, Reflex Booster, Puppet Sock, Internal Rocket","Large Size,Coronal Adaptation",70
Surya,,Biomorphs,"Named for a Hindu sun deity, suryas swim freely in the sun’s corona. Looking roughly like whales or orcas, suryas may reach lengths of ten meters or more. They generate powerful magnetic fields that shield them from solar radiation and heat, while allowing them to surf the solar wind and extract ionized particles. Strong bones and connective tissues protect against the crushing solar gravity. Beneath their thick hides are channels of liquid water interleaved with layers of fat which serve to shield the organism from harmful radiation. Engineered medichines repair tissue damaged by radiation and convert hydrogen ions into water. A surya’s skin is an extraordinary organ, embedded with chromatophores that allow them to transmit alternating patterns of light and dark for communication. In addition, a lateral line runs down their sides, allowing them to detect the long-period sound waves that re ect off the sun’s lower atmosphere and resonate through the corona’s gas and plasma. Suryas traveling through the transition zone between the corona and the chromosphere use these vibrations to predict and avoid heavy solar weather.",Expensive,30000,FALSE,SW.164,"COO:10, REF:5, SOM:5, DUR:100",,"COG:30, COO:30, INT:30, REF:30, SAV:30, SOM:30, WIL:30",Thrust Vector,,Free Fall 10,,"Basic Biomods, Basic Mesh Inserts, Chameleon Skin, Cortical Stack, Enhanced Hearing, Enhanced Vision, Lateral Line, Medichines, Vacuum Sealing","Very Large Size,Non-Human Biochemistry,Coronal Adaptation",50
Swarmanoid,,Synthmorphs,"The swarmanoid is not a single shell per se, but rather a swarm of hundreds of insect-sized robotic microdrones. Each individual “bug” is capable of crawling, rolling, hopping several meters, or using nanocopter fan blades for airlift. The controlling computer, cortical stack, and sensor systems are distributed throughout the swarm. Though the swarm can “meld” together into a roughly child-sized shape, the swarm is incapable of tackling physical tasks like grabbing, lifting, or holding as a unit. Individual bugs are quite capable of interfacing with electronics. For additional rules on swarmanoids, see p. 311, EP, and p. 211, Transhuman.",Expensive,,FALSE,EP.144,DUR:15,,"COG:30, COO:30, INT:30, REF:30, SAV:30, SOM:30, WIL:30",Rotorcraft,,,,"Access Jacks, Basic Mesh Inserts, Cortical Stack, Cyberbrain, Mnemonic Augmentation, Hopper, Walker, Puppet Sock",Swarm Composition,25
Sylph,,Biomorphs,"Sylph morphs are tailor-made for media icons, elite socialites, XP stars, models, and narcissists. Sylph gene sequences are specifically designed for distinctive good looks. Ethereal and el n features are common, with slim and lithe bodies. Their metabolism has also been sanitized to eliminate unpleasant bodily odors and their pheromones adjusted for universal appeal.",Expensive,,FALSE,EP.140,"COO:5, SAV:10, DUR:35",5,"COG:30, COO:30, INT:30, REF:30, SAV:30, SOM:30, WIL:30",Walker,,,,"Basic Biomods, Basic Mesh Inserts, Cortical Stack, Clean Metabolism, Enhanced Pheromones",Striking Looks (Level 1),40
Synth,,Synthmorphs,"Synths are anthropomorphic robotic shells (androids and gynoids). They are typically used for menial labor jobs where pods are not as good of an option. Cheaper than many other morphs, they are commonly used for people who need a body quickly and cheaply or simply on a transient basis. Though they look humanoid, synths are easily recognizable as non-biological unless they have the synthetic mask option (p. 311, EP).",High,,FALSE,EP.143,"SOM:5, DUR:40",5,"COG:30, COO:30, INT:30, REF:30, SAV:30, SOM:30, WIL:30",Walker,,,6/6,"Access Jacks, Basic Mesh Inserts, Cortical Stack, Cyberbrain, Mnemonic Augmentation, Puppet Sock","Uncanny Valley,Social Stigma:Clanking Masses",30
Synthtaur,,Synthmorphs,"The synthtaur resembles an elegant mechanical centaur, but is a versatile and extremely durable synthmorph. The shape adjusting enhancement allows it to switch between being a two-armed quadruped standing 1.7 meters tall or a four-armed biped standing 2.4 meters high, as well as allowing it to fit into small spaces. Its telescoping legs even allow it to reduce its height to become a 2-meter-tall bipedal humanoid. This morph is popular with gatecrashers, people exploring ruined habitats, and anyone going into dangerous and remote situations.",Expensive,80000,FALSE,TH.196,"SOM:10, DUR:60","5,5","COG:30, COO:30, INT:30, REF:30, SAV:30, SOM:40, WIL:30",Walker,,,8/8,"Access Jacks, Basic Mesh Inserts, Cortical Stack, Cyberbrain, Grip Pads, Mnemonic Augmentation, Pneumatic Limbs, Prehensile Feet, Shape Adjusting, Telescoping Limbs",,70
Takko,,Synthmorphs,"The  fist synthetic octopus design from the engineers at Feral Robot is a hardy shell custom-designed to make octopi uplifts feel more at home in a synthetic body with eight functioning appendages. Though it lacks ink sacs, the takko features vectored-thrust jets for micro- gravity propulsion.",Expensive,45000,FALSE,PO.144,"COO:5, INT:5, SOM:5, DUR:40",,"COG:30, COO:30, INT:30, REF:30, SAV:30, SOM:30, WIL:30",Walker,,"Climbing 10,Free Fall 10",8/8,"360-Degree Vision, Access Jacks, Basic Mesh Inserts, Chameleon Skin, Cortical Stack, Cyberbrain, Enhanced Vision, Extra Limbs, Grip Pads, Mnemonic Augmentation, Polarization Vision, Thrust Vector, Puppet Sock",,60
Theseus,,Biomorphs,"While there are no sanctioned explorations of Earth, a few daring or greedy transhumans defy the laws to salvage there. Some scavengers and explorers still scour the ruins of habitats that were destroyed during the Fall. Others look for wealth and secrets in the quarantined zones on Luna and Mars. Some simply seek out remaining TITAN machines to destroy, wherever they may be found. The theseus is a popular biomorph for this type of work. Its medichines and nanophages keep the morph protected from most attacks by exsurgent nanotech, and the lack of a cyberbrain makes it less vulnerable to mind hacking. An emergency farcaster allows the user to safely return from situations where both their morph and their cortical stack might be destroyed or corrupted.",Expensive,,FALSE,TH.196,"SOM:5, WIL:5, DUR:40",5,"COG:30, COO:30, INT:30, REF:30, SAV:30, SOM:30, WIL:30",Walker,,,,"Basic Biomods, Basic Mesh Inserts, Bioweave Armor: Light, Cortical Stack, Direction Sense, Emergency Farcaster, Enhanced Vision, Low Pressure Tolerance, Medichines, Nanophage, Oxygen Reserve, Radiation Sense, T-Ray Emitter, Temperature Tolerance (Cold), Toxin Filters",,30
Vacuum Pod,,Pods,"Optimized for vacwork, this pod is preferred in situations where novacrabs or synths don't fare as well socially. The vacuum pod is based on the bouncer morph and looks superficially identical to one.",Expensive,,FALSE,TH.197,"COO:5, SOM:5, DUR:35",5,"COG:30, COO:30, INT:30, REF:30, SAV:30, SOM:30, WIL:30",Walker,,,,"Basic Biomods, Basic Mesh Inserts, Bioweave Armor: Light, Cortical Stack, Cyberbrain, Enhanced Respiration, Grip Pads, Mnemonic Augmentation, Oxygen Reserve, Prehensile Feet, Puppet Sock, Vacuum Sealing",Social Stigma:Pod,30
Venusian Glider,,Biomorphs,"The glider is designed to survive for many hours in Venus’s unbreathable atmosphere. Tall and thin, with long, strong limbs and a lightweight build, this morph also features gliding membranes (p. 166, Sunward) that allow it to soar through the upper Venusian atmosphere. It can even gain altitude by riding thermals (which it can see using its enhanced vision). Once Venusian terraforming efforts are complete, an upgraded version of this morph will be able to breathe normally.",Expensive,,FALSE,SW.164,"REF:5, SOM:5, DUR:30","5,5","COG:30, COO:30, INT:30, REF:30, SAV:30, SOM:30, WIL:30",Winged,,,,"Basic Biomods, Basic Mesh Inserts, Cortical Stack, Enhanced Respiration, Enhanced Vision, Gliding Membranes, Grip Pads, Prehensile Feet, Respirocytes",Limber (Level 1),40
Whiplash,,Pods,"Designed by autonomist xenobotanists as an experiment in developing a cyberbrain/planimal interface, whiplash pods are bioengineered from planimal stock found on Sunrise (see Exotic Life, p. 130, Gatecrashing), with other transgenic features (see Whiplash, p. 173, Gatecrashing). Whiplash pods are gaining some traction among gatecrashers due to their ability to blend in to arboreal environments. The primary modi cation made to the whiplash stock was to turn the entire organism upside down and orient the digestive portion of the organism horizontally, so that the whiplash’s tri-lobed orifice faces forward. The whiplash’s grasping roots were also converted into even more motile “walking tentacles” borrowed from other Sunrise planimals. Other adjustments include the addition of a pair of grasping limbs, each with four universally opposable digits; artificial sensing mods (providing transhuman-standard sensing ability); and a general toughening of the internal structure for rigidity and support. The barrel-like body remains very similar to the original planimal stock and, reorientation notwithstanding, the digestive system remains mostly unchanged. The ability to extend and retract the whiplash’s feeding tendril was heavily enhanced, so now the tendril acts more like a two-meter-long chameleon-like tongue than a hanging food-trap.",Expensive,50000,FALSE,GC.151,"COO:5, SOM:10, DUR:40","5,5","COG:30, COO:30, INT:30, REF:30, SAV:30, SOM:30, WIL:30",Walker,,,,"Access Jacks, Basic Biomods, Basic Mesh Inserts, Chameleon Skin, Cortical Stack, Cyberbrain, Mnemonic Augmentation, Puppet Sock","Social Stigma:Pod,Alien Biochemistry",50
Wirehead,,Eidelons,"Regardless of whether an infomorph controls fightercraft, tiny surveillance drones, or attack robots, this high-end eidolon is one that almost all people in those professions wish they had access to.",Expensive,60000,FALSE,TH.142,"REF:10, SPD:2",5,"COG:40, COO:40, INT:40, REF:40, SAV:40, SOM:40, WIL:40",,,,,"Increased Speed, Mental Speed, Mnemonic Augmentation, Panopticon",,60
Wizard,,Synthmorphs,Specialized for infosec and communications tasks. ,Expensive,35000,FALSE,TH.203,"COG:5, INT:5, DUR:25",,"COG:30, COO:30, INT:30, REF:30, SAV:30, SOM:25, WIL:30",Walker,,,4/4,"Access Jacks, Basic Mesh Inserts, Cortical Stack, Cyberbrain, Mental Speed, Mnemonic Augmentation, Modular Design, Shape Adjusting, Hovercraft",Small Size,35
Worker Pod,,Pods,"Part exalt human, part machine, these pods are virtually indistinguishable from humans. Worker pods are often used in menial labor jobs where interaction with humans is necessary.",High,,FALSE,EP.142,"SOM:10, DUR:35",5,"COG:30, COO:30, INT:30, REF:30, SAV:30, SOM:30, WIL:30",Walker,,,,"Basic Biomods, Basic Mesh Inserts, Cortical Stack, Cyberbrain, Mnemonic Augmentation, Puppet Sock",Social Stigma:Pod,20
Xu Fu,,Synthmorphs,"Named after a historical Chinese explorer, many gatecrashers consider xu fus the ideal exoplanet exploration synthmorph. Its main body sits atop 6 legs (up to 2 meters long, though retractable) that end in multidirectional smart wheels for quick travel, capable of rolling in any direction and over rough terrain. For exception- ally difficult terrain, the wheels can be retracted and the xu fu can maneuver as a walker. In addition to two standard arms, it features a third 2-meter long sensor-equipped limb for reaching far distances, overseeing obstacles, etc. Xu fus have an impressive sensor package and are ideal for surface-based scouting as well as investigating tunnels, collecting samples, and so on.",Expensive,50000,FALSE,GC.151,"COO:5, SOM:5, DUR:40",,"COG:30, COO:30, INT:30, REF:30, SAV:30, SOM:30, WIL:30",Walker,,,8/8,"360-Degree Vision, Access Jacks, Basic Mesh Inserts, Cortical Stack, Cyberbrain, Direction Sense, Echolocation, Electrical Sense, Enhanced Hearing, Enhanced Vision, Grip Pads, Lidar, Mnemonic Augmentation, Pneumatic Limbs, Radar System, Radiation Sense, Telescoping Limbs, T-Ray Emitter, Wheeled, Puppet Sock",,60
Yeoman,,Flexbots,"This is the basic flexbot module. It replaces the flexbot morph on p. 144, EP. Designed for multipurpose functions, flexbots can transform their shells to suit a range of situations and tasks. Their core frame consists of a half-dozen interlocking and shape-adjustable modules capable of auto-transforming into a variety of shapes: multilegged walker, tentacle, hovercraft, and many others. Each module features its own sensor units and bush robot fractal-branching digits (capable of breaking into smaller digits, down to the micrometer scale, allowing for ultra-fine manipulation). The flexbot control computer is also distributed between modules. Individual flexbots are only the size of a large dog, but multiple flexbots can join together for larger mass operations, even taking on heavy-duty tasks such as demolition, excavation, manufacturing, robotics assembly, and so on.",Expensive,,FALSE,TH.203,DUR:25,5,"COG:30, COO:30, INT:30, REF:30, SAV:30, SOM:25, WIL:30",Walker,,,4/4,"Access Jacks, Basic Mesh Inserts, Cortical Stack, Cyberbrain, Fractal Digits, Mnemonic Augmentation, Modular Design, Nanoscopic Vision, Shape Adjusting, Hovercraft",Small Size,20