Name,shortname,Type,Description,Cost,Minimum,Blueprints,Source,Stats,Variance,Stat Max,mobility,speed,Skills,Armor,Augmentations,Traits,CP
Flat,,Biomorphs,"Flats are baseline unmodified humans, born with all of the natural defects, hereditary diseases, and other genetic mutations that evolution so lovingly applies. Flats are increasingly rare—most died off with the rest of humanity during the Fall. Most new children are splicers—screened and genefixed at the least—except in habitats where flats are treated as second-class citizens and indentured labor.",High,,FALSE,EP.139,DUR:20,,"COG:20, COO:20, INT:20, REF:20, SAV:20, SOM:20, WIL:20",Walker,,,,,,0
Flying Squid,,Pods,"Given the popularity of octomorphs even among nonmercurials, morph designers have sought out a similar morph that is operable in zero g and also designed for speed. Its streamlined form resembles a stylized squid and this morph can move swiftly in both water and air. It can suck either water or air into a cavity in its mantle and then expel it out a siphon in a chosen direction for fast, jet-like propulsion. While popular with neo-octopi, its speed and overall utility has made it an increasingly favorite option with others seeking an aquatic-adapted morph.",Expensive,60000,FALSE,TH.191,"COO:5, SOM:5, DUR:40",5,"COG:30, COO:30, INT:30, REF:30, SAV:30, SOM:30, WIL:30",Submarine,,Swimming 30,,"360-Degree Vision, Access Jacks, Basic Mesh Inserts, Chameleon Skin, Cortical Stack, Cyberbrain, Grip Pads, Hydrostatic Pressure Adaptation, Mnemonic Augmentation, Polarization Vision, Puppet Sock",Limber (Level 2),55
Freeman,,Biomorphs,"Many leaders want to ensure loyalty or at least obedience from their citizens, especially recently sleeved infugees. The freeman biomorph offers rulers (some would say tyrants or dictators) a chance to offer citizens a new life without worrying about dissidence. Based on the splicer morph, the freeman is genetically modified to be more obedient, which results in lower Willpower. More insidiously, freeman morphs are genetically modified with a protein that makes their neurons sensitive to light. When combined with an optogenetics module implant (p. 197), these neurons can be activated and deactivated remotely, enabling a monitoring muse or meshed overseer to control the ego's behavior. (The specific behavior affected is chosen with each optogenetics module implant.)

The freeman comes with a specialized monitor AGI installed in a modified ghostrider module. The monitor, usually a modified fork of the tyrant's muse, watches and reports all suspicious actions taken by the primary ego. The purpose of this implant is often concealed. Citizens who sleeve into a freeman morph are told the implant is a security measure that helps prevent infection from TITAN technology or some similar lie. The module is designed to resist tampering and will report to headquarters the instant it detects a hacker's intrusion. The monitor muse can manipulate the ego's behavior or even take control of the morph via its puppet sock, but avoids doing that unless absolutely necessary. Dictators do not want to reveal that their citizens have spies implanted in their skulls, watching them.

Surprisingly, some people voluntarily sleeve into freeman morphs, preferring to hand responsibility and decision-making over to other parties, such as the Sendero Luminoso Benevolent Dictatorship habitat in the Neptunian Trojans.",High,,FALSE,TH.191,"SAV:5, WIL:-5, DUR:30",5,"COG:25, COO:25, INT:25, REF:25, SAV:25, SOM:25, WIL:25",Walker,,,,"Basic Biomods, Basic Mesh Inserts, Cortical Stack, Monitor Module, Optogenetics Module, Puppet Sock",,10
Fury,,Biomorphs,"Furies are combat morphs. These transgenic human upgrades feature genetics tailored for endurance, strength, and re exes, as well as behavioral modifications for aggressiveness and cunning. To offset tendencies for unruliness and macho behavior patterns, furies feature gene sequences promoting pack mentalities and cooperation, and they tend to be biologically female.",Expensive,40000,FALSE,EP.140,"COO:5, REF:5, SOM:10, WIL:5, DUR:50",5,"COG:30, COO:30, INT:30, REF:30, SAV:30, SOM:30, WIL:30",Walker,,,,"Basic Biomods, Basic Mesh Inserts, Cortical Stack, Bioweave Armor: Light, Enhanced Vision, Neurachem (Level 1), Toxin Filters",,75
Futura,,Biomorphs,"An exalt variant, futura morphs were specially crafted for the “Lost generation.” Tailor-made for accelerated growth and adjusted for confidence, self-reliance, and adaptability, futuras were intended to help transhumanity regain its foothold. These programs proved disastrous and the line was discontinued, but some models remain, viewed by some with distaste and others as collectibles or exotic oddities.",Expensive,50000,FALSE,EP.140,"COG:5, SAV:5, WIL:10, DUR:35",5,"COG:30, COO:30, INT:30, REF:30, SAV:30, SOM:30, WIL:30",Walker,,,,"Basic Biomods, Basic Mesh Inserts, Cortical Stack, Eidetic Memory, Emotional Dampers",,40
Galatea,,Synthmorphs,A group of Lunar morph designers created this high-end synthmorph in an attempt to increase the social acceptance of synthmorphs by showcasing how attractive and versatile they can be. This elegant morph looks expensive and is designed to allow the user to master any social situation. A few media icons and socialites have already found that this morph's mixture of utility and novelty value has helped enhance their fame and reputation.,Expensive,70000,FALSE,TH.192,"COO:5, INT:5, SAV:10, DUR:40",5,"COG:30, COO:30, INT:30, REF:30, SAV:30, SOM:30, WIL:30",Walker,,,6/6,"Access Jacks, Basic Mesh Inserts, Chameleon Skin, Cortical Stack, Cyberbrain, Enhanced Hearing, Mnemonic Augmentation",,65
Gargoyle,,Synthmorphs,"Gargoyles are an anthroform synthetic morph designed as a mobile sensor unit. They are used by media, freelance journalists, forensics teams, and anyone who is regularly required to document a situation thoroughly. Though humanoid in shape, gargoyles stand taller than average transhumans for better viewing. Much of their exterior surface is covered in quantum dot camera-displays.",Expensive,,FALSE,PO.142,"INT:5, DUR:40",5,"COG:30, COO:30, INT:30, REF:30, SAV:30, SOM:30, WIL:30",Walker,,,,"360-Degree Vision, Access Jacks, Anti-Glare, Basic Mesh Inserts, Chemical Sniffer, Cortical Stack, Cyberbrain, Enhanced Hearing, Enhanced Smell, Enhanced Vision, Lidar, Mnemonic Augmentation, Nanoscopic Vision, Oracles, Radar System, T-Ray Emitter, Puppet Sock",,40
Ghost,,Biomorphs,"Ghosts are partially designed for combat applications, but their primary focus is stealth and ifiltration. Their genetic profile encourages speed, agility, and re exes, and their minds are modi ed for patience and problem-solving.",Expensive,40000,FALSE,EP.140,"COO:10, REF:5, SOM:5, WIL:5, DUR:45",5,"COG:30, COO:30, INT:30, REF:30, SAV:30, SOM:30, WIL:30",Walker,,,,"Basic Biomods, Basic Mesh Inserts, Cortical Stack, Chameleon Skin, Adrenal Boost, Enhanced Vision, Grip Pads",,70
Grey,,Biomorphs,"Originally created as part of a fad based on 20th-century images of aliens, the grey morph soon became popular with eccentric scientists and engineers. This morph's slender and weak-looking body stands only 1.5 meters tall, short compared to modern transhumans. Its distinctive large head and eyes strike many transhumans as disturbing.",Expensive,30000,FALSE,TH.192,"COG:5, WIL:5, DUR:30",5,"COG:30, COO:30, INT:30, REF:30, SAV:30, SOM:20, WIL:30",Walker,,,,"Basic Biomods, Basic Mesh Inserts, Circadian Regulation, Clean Metabolism, Cortical Stack, Eidetic Memory, Emotional Dampers, Enhanced Vision, Math Boost",Uncanny Valley,25
Griefer,,Synthmorphs,"Based on the case synthmorph design, griefers are used by vandals, terrorists, and dedicated trolls to harass enemies and antagonize the masses. Griefers have embedded sound and holographic display systems so they can easily harass an individual or an entire crowd. They are also typically equipped with numerous hacking tools and software aids, though they do not come with these by default. Most importantly, they are built without cortical stacks, so if they are destroyed, the ego cannot be interrogated through psychosurgery. Griefers are illegal in many habitats, especially in the Planetary Consortium, but DRM-free blueprints are easy to find in many darknets, thus making them a persistent annoyance in some systems. A few habitats have passed laws mandating that killing a griefer is not considered murder, assault, or even destruction of property.",Moderate,,TRUE,TH.192,DUR:20,"-5,-5","COG:20, COO:20, INT:20, REF:20, SAV:20, SOM:20, WIL:20",Walker,,,4/4,"Access Jacks, Basic Mesh Inserts, Cyberbrain, Holographic Projector, Sound System, Mnemonic Augmentation, Puppet Sock","Social Stigma:Griefer,No Cortical Stack,Lemon",5
Grimoire,,Flexbots,Grimoires are an excellent complement to a wizard module.,Expensive,25000,FALSE,TH.202,"WIL:5, DUR:20",,"COG:30, COO:30, INT:30, REF:30, SAV:30, SOM:25, WIL:30",Walker,,,6/6,"Access Jacks, Basic Mesh Inserts, Cortical Stack, Cyberbrain, Electrical Sense, Ghostrider Module, Mnemonic Augmentation, Modular Design, Multitasking, Shape Adjusting, Skinlink, Hovercraft",Small Size,20
Guard,,Synthmorphs,"Everyone knows that synthmorphs are tougher and better equipped for serious combat than biomorphs. However, many people in the inner system are not comfortable with using hulking synthmorphs as bodyguards or security personnel. Instead, some choose this subtle and extremely deadly alternative. This morph's enhanced senses allow it to more easily detect any threats to the person the user is guarding, and the built-in weaponry and moderate armor make it highly resistant to damage. The synthetic mask disguises it quite effectively as an olympian or fury morph.",Expensive,60000,FALSE,TH.192,"COO:5, SOM:10, DUR:40",5,"COG:30, COO:30, INT:30, REF:30, SAV:30, SOM:30, WIL:30",Walker,,,12/12,"Access Jacks, Basic Mesh Inserts, Chemical Sniffer, Cortical Stack, Cyberbrain, Cyberclaws, Enhanced Vision, Hand Laser, Lidar, Mnemonic Augmentation, Neurachem (Level 1), Puppet Sock, Synthetic Mask, T-Ray Emitter",,60
Guard Deluxe,,Synthmorphs,This morph is used by both top-of-the-line security personnel and wealthy and powerful people who worry about kidnapping and similar threats and wish to be able to personally respond to any problems.,Expensive,80000,FALSE,TH.192,"COO:5, REF:5, SOM:10, DUR:50",5,"COG:30, COO:30, INT:30, REF:30, SAV:30, SOM:30, WIL:30",Walker,,,12/12,"Access Jacks, Basic Mesh Inserts, Chemical Sniffer, Cortical Stack, Cyberbrain, Cyberclaws, Enhanced Vision, Hand Laser, Lidar, Mnemonic Augmentation, Neurachem (Level 1), Puppet Sock, Synthetic Mask, T-Ray Emitter, Nanophage, Weapon Mount: Concealed",,75
Hazer,,Biomorphs,"Hazers are tall, fine-boned morphs, lightly muscled but heavily insulated against loss of body heat. Even with all of their augmentations, hazers can't survive exposure to the frigid atmosphere of Titan-but they can handle it slightly longer than other morphs. Hazers tend to be fair and slender, with chiseled features. Some have features so angular or elfin that their beauty is alien and unsettling to other human phenotypes. Striking Looks and Uncanny Valley are both common morph traits.",Expensive,,FALSE,RW.186,"COO:5, WIL:5, DUR:35","5,5","COG:30, COO:30, INT:30, REF:30, SAV:30, SOM:30, WIL:30",Walker,,,,"Basic Biomods, Basic Mesh Inserts, Cortical Stack, Enhanced Vision, Radiation Sense, Respirocytes, Temperature Tolerance (Cold)",,35
Hibernoids,,Biomorphs,"Hibernoids are transgenic-modified humans with heavily altered sleep patterns and metabolic processes. Hibernoids have a decreased need for sleep, requiring only 1–2 hours a day on average. They also have the ability to trigger a form of voluntary hibernation, effectively stopping their metabolism and need for oxygen. Hibernoids make excellent long-du- ration space travelers and habtechs, but these morphs are also favored by personal aides and hypercapitalists with non-stop lifestyles.",Expensive,,FALSE,EP.140,"INT:5, DUR:35",5,"COG:25, COO:25, INT:25, REF:25, SAV:25, SOM:25, WIL:25",Walker,,,,"Basic Biomods, Basic Mesh Inserts, Cortical Stack, Circadian Regulation, Hibernation",,25
Hot Shot,,Eidelons,"When you really want to pilot a high-speed spacecraft, you don't want to have to worry how your squishy biomorph is going to hold up under high-g maneuvers. This eidolon is quite popular among fightercraft pilots as well as among infomorphs who specialize in controlling and directing robots.",Expensive,35000,FALSE,TH.142,"REF:5, SPD:2",5,"COG:40, COO:40, INT:40, REF:40, SAV:40, SOM:40, WIL:40",,,,,"Increased Speed, Mnemonic Augmentation",,35
Hulder,,Biomorphs,"Hulder are engineered for survival in the Titanian wilds. In silhouette, their bodies resemble a longlegged great auk, though viewed up close, the resemblance to a bird ends. Hulder have no feathers, but rather smooth, rubbery charcoal or black skin covering a thick layer of nano-augmented blubber. What resembles a thick bill from a distance is actually a seamless protrusion of the face, packed with sensory augmentations. Hulder stand 2 meters tall and weigh on average 135 kilograms. Their sensory organs, webbed feet, and fingers are all cybernetic.

Hulder can only tolerate temperatures hospitable to baseline transhumans for short periods of time. In the open, they must balance their bodies' chemical reservoirs with other hulder and caribou once per month or with a chemical reserve pack. A typical band of 2-6 hulder and 10-20 caribou can go about a year before having to visit a hab or a station like Huvudskär to replenish chemical reserves.",Expensive,40000,FALSE,RW.186,"SOM:5, WIL:10, DUR:40",5,"COG:30, COO:30, INT:30, REF:30, SAV:30, SOM:30, WIL:30",Walker,,,,"Basic Biomods, Basic Mesh Inserts, Bioweave Armor: Light, Cortical Stack, Digging Claws, Direction Sense, Enhanced Vision, Long Term Life Support, Oxygen Reserve, Radiation Sense, Swim Bladder, T-Ray Emitter, Temperature Tolerance (Cryonic)","Non-Mammalian Biochemistry,Temperature Intolerance (Warm)",50
Hyperbright,,Biomorphs,"This morph is an attempt by a research team on Bright to create a successor to the menton, making it the most intelligence-enhanced morph ever created. Work on the hyperbright morph has been plagued with difficulties, as the designers attempt to push technical limits, creating a morph that can work at peak efficiency without distraction for long periods of time. In an effort to create a morph that proves their design and earns some positive reputation for their project, the creators took short cuts that caused the morph to have several distinctive and potentially annoying quirks, including an inherent need for drugs to stabilize its exotic neurochemistry. The result is a morph that is instantly recognizable by the brightly colored bony crest along the skull that helps cool its brain. Despite its quirks, the hyperbright has gained a small following among a number of scientists and engineers, especially since it has been optimized for use in the low-g environments of the outer system. When created or used on Bright, this morph is usually also fitted with the parallel processor nanoware (p. 189).",Expensive,40000,FALSE,RW.186,"COG:15, INT:10, WIL:5, DUR:35",5,"COG:40, COO:30, INT:40, REF:30, SAV:30, SOM:30, WIL:30",Walker,,,,"Basic Biomods, Basic Mesh Inserts, Circadian Regulation, Cortical Stack, Eidetic Memory, Endocrine Control, Grip Pads, Hyper Linguist, Math Boost, Mental Speed, Prehensile Feet","Fast Metabolism,Addiction (Level 1):Comfurt",70
Hypergibbon,,Pods,"Built from siamang genestock, the largest of the lesser apes, hypergibbons are often mistaken for uplifts, although this is not the case. The gibbon was never a candidate for uplift due to a brain anatomy considerably more primitive than great apes. With the addition of a cyberbrain, though, they make excellent pods. Many primate uplifts choose hypergibbons in place of other pods or when they need something small like a neotenic.

Hypergibbons stand about 1 meter tall, weigh 15 kilograms, and typically have black fur and skin (although bodysculpting permits many variations). They have inflatable throat sacks that allow melodious calls that carry great distances. Their wrists feature a ball-and-socket joint and also naturally dislocate to enable easier swinging by the arms.",Expensive,,FALSE,PO.142,"INT:5, REF:5, DUR:25",,"COG:30, COO:30, INT:30, REF:30, SAV:30, SOM:30, WIL:30",Walker,,,,"Basic Biomods, Basic Mesh Inserts, Cortical Stack, Cyberbrain, Mnemonic Augmentation, Prehensile Feet, Puppet Sock","Social Stigma:Pod,Small Size,Non-Human Biochemistry",30
Infomorph,,Eidelons,Infomorphs are digital only forms. Infomorphs are sometimes carried by other characters instead of a muse or in a ghostrider module.,Trivial,,FALSE,EP.145,SPD:2,,"COG:40, COO:40, INT:40, REF:40, SAV:40, SOM:40, WIL:40",,,,,Mnemonic Augmentation,,0
Jenkin,,Pods,"The handiwork of scum genehacker Neville Orsonglass, the jenkin is a byproduct of desperate measures taken during the Fall. The original model was simply the designer's attempt to keep him and his crewmates alive on a ship with failing life support and recycling systems. From there, it has evolved into the ultimate survivor's morph, though the definition of survivor has now been extended to can take all of the drugs and still function sexually. This seems to be a selling point with the scum. Despite the morph's stooped posture, rat-like features, and pungent personal aroma, the implausibly sized secondary sexual characteristics make it the life of certain kinds of parties.",High,,FALSE,TH.193,"COO:5, INT:5, REF:5, SOM:10, DUR:35",,"COG:25, COO:25, INT:25, REF:25, SAV:25, SOM:25, WIL:25",Walker,,,,"Basic Biomods, Basic Mesh Inserts, Cortical Stack, Cyberbrain, Digestive Symbiotes, Enhanced Pheromones, Enhanced Respiration: Mars, Enhanced Smell, Hibernation, Mnemonic Augmentation, Possum Cache, Prehensile Tail, Puppet Sock, Temperature Tolerance, Toxin Filters","Social Stigma:Pod,Unattractive (Level 2)",20
Kite,,Synthmorphs,"This small shape-shifting synthetic shell is capable of flight no matter the atmospheric environment—or lack thereof. Its default mode is turbofan-driven rotorcraft; its light weight allows it to fly and hover even in thin atmospheres and heavy gravities. In streamlined ionic mode, it can travel at high speeds and maneuver in hurricane-force winds. In vacuum, it can drive itself with thrust-vector nozzles. Sometimes called “multifliers,” kites are popular among gatecrashers and gatehoppers due to their adaptability and usefulness for aerial recon and surveys.",High,,FALSE,GC.150,20,5,"COG:25, COO:25, INT:25, REF:25, SAV:25, SOM:25, WIL:25",Walker,,,2/2,"Access Jacks, Anti-Glare, Basic Mesh Inserts, Chemical Sniffer, Cortical Stack, Cyberbrain, Direction Sense, Enhanced Hearing, Enhanced Vision, Lidar, Mnemonic Augmentation, Radar System, Shape Adjusting, T-Ray Emitter, Ionic, Thrust Vector, Winged, Puppet Sock",Small Size,30
Liquid Silver,,Synthmorphs,"Designed as a top-end version of the steel morph, this shell’s entire outer covering is composed of active nanomachines. A number of synthmorph performers use this shell’s shape- and color-altering capacities as part of their acts. However, the fact that this morph can disguise itself as any other humanoid synthmorph, including the ubiquitous case morph, means that a number of covert operatives and criminals also make use of this morph. This version of the steel morph cannot use a synthetic mask.",Expensive,40000,FALSE,SW.163,"COG:5, SOM:10, DUR:40","5,5,5","COG:30, COO:30, INT:30, REF:30, SAV:30, SOM:30, WIL:30",Walker,,,8/8,"Access Jacks, Basic Mesh Inserts, Cortical Stack, Cyberbrain, Eidectic Memory, Mnemonic Augmentation, Shape Adjusting, Skinflex, Wrist-Mounted Tools, Puppet Sock","Uncanny Valley,Social Stigma:Clanking Masses",70
Longbow,,Synthmorphs,Longbows provide a weapons platform.,Expensive,,FALSE,TH.202,"REF:5, DUR:25",,"COG:30, COO:30, INT:30, REF:30, SAV:30, SOM:25, WIL:30",Walker,,,4/4,"Access Jacks, Basic Mesh Inserts, Cortical Stack, Cyberbrain, Heavy Combat  Mnemonic Augmentation, Modular Design, Weapon Mount: Articulated, Hovercraft, Shape Adjusting",Small Size,20
Lunar Flier,,Biomorphs,"This morph is a version of the exalt morph that has been adapted to fly in Earth normal air pressure as long as the gravity is 0.2 g or less. Though this morph is available on other low-g worlds and habitats, it was developed for and is primarily found on Luna. This morph resembles a typical exalt morph, except that it is lightly built, has larger lungs, and has feathered wings with a wingspan of 3 meters. The wings come out of the back torso and leave the morph’s hands and wrists unhindered. The wings may also be folded behind the body.",Expensive,,FALSE,SW.162,"COG:5, COO:5, DUR:30","5,5","COG:30, COO:30, INT:30, REF:30, SAV:30, SOM:30, WIL:30",Walker,,,,"Basic Biomods, Basic Mesh Inserts, Clean Metabolism, Cortical Stack, Enhanced Vision, Wings",,35
Martian Alpiner,,Biomorphs,"Alpiners were a relatively common biomorph design on early frontier Mars, when temperatures and atmospheric pressure had not yet risen to present levels. Now they are found predominantly in the city of Olympus, where environmental conditions will always be incredibly harsh. Avid rock climbers and outdoor types also favor this morph, and in recent years it has enjoyed an unusual vogue among chic urbanites going for a rough-and-ready look without sleeving in the more de classe ruster morph.",Expensive,,FALSE,SW.162,"SOM:5, DUR:40",,"COG:25, COO:25, INT:25, REF:25, SAV:25, SOM:25, WIL:25",Walker,,Climbing 10,,"Basic Biomods, Basic Mesh Inserts, Cortical Stack, Direction Sense, Grip Pads, Low Pressure Tolerance, Oxygen Reserve, Respirocytes, Temperature Tolerance (Cold)",Fast Metabolism,30
Masked Steel,,Synthmorphs,"This version of the steel morph is equipped with the synthetic mask enhancement, making the shell look like a human biomorph. This version is uncommon, as most Steel Liberators view biological masking as a form of “selling out.” It is used both by Lunars who are stuck sleeving into a synthmorph, but whom don’t want to suffer discrimination, and by Steel Liberator activists looking to infiltrate biochauvinists and other opponent groups.",Expensive,40000,FALSE,SW.163,"COG:5, SOM:10, DUR:40","5,5","COG:30, COO:30, INT:30, REF:30, SAV:30, SOM:30, WIL:30",Walker,,,8/8,"Access Jacks, Basic Mesh Inserts, Cortical Stack, Cyberbrain, Eidectic Memory, Mnemonic Augmentation, Synthetic Mask, Puppet Sock",,55
Menton,,Biomorphs,"Mentons are genetically modified to increase cognitive abilities, particularly learning ability, creativity, attentive- ness, and memory. Rumors exist of super-enhanced mentons with more extreme intelligence mods, but brain- hacking is notoriously difficult, and many attempts to redesign mental faculties result in impaired functioning, instability, or insanity.",Expensive,,FALSE,EP.139,"COG:10, INT:5, WIL:5, DUR:35",5,"COG:30, COO:30, INT:30, REF:30, SAV:30, SOM:30, WIL:30",Walker,,,,"Basic Biomods, Basic Mesh Inserts, Cortical Stack, Eidetic Memory, Hyper Linguist, Math Boost",,40
Mimic,,Synthmorphs,"In its basic form, with its limbs retracted, a mimic morph resembles a spare (p. 151, Gatecrashing) and is only a bit larger than a human head. With its four pencil-thin telescoping legs fully extended, it can stand up to two meters tall, and its arms can also each reach up to two meters from the morph. These limbs can all be fully retracted and the user can also alter the morph's shape and appearance, causing it to look like almost any small object such as a briefcase, cleaning robot, or household appliance. This morph can easily fit through small spaces and hide itself with great ease and is ideal for infiltration and sabotage missions.",Expensive,30000,FALSE,TH.193,"COO:5, DUR:25",5,"COG:30, COO:30, INT:30, REF:30, SAV:30, SOM:20, WIL:30",Walker,,,4/4,"Access Jacks, Basic Mesh Inserts, Chameleon Skin, Cortical Stack, Cyberbrain, Enhanced Vision, Grip Pads, Mnemonic Augmentation, Puppet Sock, Shape Adjusting, Skinflex, Telescoping Limbs","Social Stigma:Clanking Masses,Small Size",25
Nautiloid,,Synthmorphs,"Nautiloids are a hybrid of short-range spacecraft and submersible capable of holding up to six passengers and their gear. The morph is shaped like a van-sized nautilus, with crew space in the head and shell. A cluster of tentacular limbs mounted under the observation ports in the head provide both fine and brute force manipulation. Originally created for comet and asteroid mining, the design also proved useful for oceanic exploration by gatecrashing teams and Europans.

The morph's interior includes a desktop cornucopia machine and a maker. It can deploy a pair of retractable pontoons for stability when floating on a liquid surface. A nautiloid's life support system can support its occupants for up to three months before replenishing-indefinitely if it has a source of hydrogen and oxygen. Nautiloids include radiation shielding, a small airlock, and a healing vat. The nautiloid is also available as a bot with no cyberbrain for the same cost. The bot version has no aptitude bonuses.",Crazypants,150000,FALSE,TH.193,"SOM:5, DUR:200","5,5","COG:30, COO:30, INT:30, REF:30, SAV:30, SOM:30, WIL:30",Submarine,,,10/10,"Basic Mesh Inserts, Cortical Stack, Cyberbrain, Echolocation, Hydrostatic Pressure Adaptation, Mnemonic Augmentation, Pneumatic Limbs, Puppet Sock, Radar System, Radiation Sense, Swim Bladder, Telescoping Limbs, T-Ray Emitter, Internal Rocket",Large Size,155
