name,shortname,type,description,cost,minimum,blueprints,source,effect,dice,mod,ap,atk bonus,modes,rounds,linked skill,aoe,extra effect,ranges,reach,is ammo,is mod,uses ammo,uses mods
Minimissile Seeker Rifle,Seeker Rifle,Seeker,The seeker rifle comes in a bullpup configuration and fires minimissiles in semi-auto mode. It is a two-handed weapons.,High,,TRUE,EP.339,,,,,,SA,6,Seeker Weapons,,,150/300/600/2000,,FALSE,FALSE,TRUE,TRUE
Seeker Armband,,Seeker,"This weapons unit is worn on the arm, allowing the user to point and fire using an entoptic smartlink system. Though highly portable, the armband's micromissile supply is low. It fires in single-shot mode.",Moderate,,TRUE,EP.339,,,,,,SS,4,Seeker Weapons,,,70/180/600/2000,,FALSE,FALSE,TRUE,TRUE
Seeker Pistol,,Seeker,This pistol-sized seeker launcher fires micromissiles in semi-auto mode.,Moderate,,TRUE,EP.339,,,,,,SA,8,Seeker Weapons,,,70/180/600/2000,,FALSE,FALSE,TRUE,TRUE
HOPLITE Seeker,,Seeker,,,,FALSE,,,,,,,SS,,Seeker Weapons,,,,,FALSE,FALSE,TRUE,TRUE
Torch,,Spray Weapon,"This modern flamethrower uses condensed ammunition capsules rather than fuel tanks, scorching targets and setting them on fire. Any hit that is an Excellent Success (MoS 30+) sets the target on fire, where they will continue to take 2d10 damage per Action Turn. These chemical fires are particularly difficult to put out unless they are deprived of oxygen. Torches are two-handed.",Moderate,,TRUE,EP.341,,3,,-4,,SS,20,Spray Weapons,Cone,,,,FALSE,FALSE,TRUE,TRUE
Shard Pistol,,Spray Weapon,"The shard pistol is a flechette weapon, firing a stream of of diamondoid monomolecular shards at high velocities. These micro flechettes are very good at penetrating armor, but they do not disperse kinetic energy well and so do not cause as much tissue damage as kinetic weapons. Shard ammunition is often coated with drugs or toxins for extra efficiency.",Low,,TRUE,EP.341,,1,6,-10,,"SA,BF,SA",100,Spray Weapons,Cone,,,,FALSE,FALSE,TRUE,TRUE
Shredder,,Spray Weapon,"A heavier version of the shard pistol, the shredder  res a larger cloud of lethal flechettes, enough to shred a portion of the target into a fine mist.",Moderate,,TRUE,EP.341,,2,5,-10,,"SA,BF,FA",100,Spray Weapons,Cone,,,,FALSE,FALSE,TRUE,TRUE
Buzzer,,Spray Weapon,"Equipped with a specialized nanobot hive, Buzzers are used to spray a nanoswarm on a target or area. They have a limited capacity of swarms, though the nanohive can construct one new swarm each hour. This weapon is two-handed.",Moderate,,TRUE,EP.341,,,,,,SS,3,Spray Weapons,,D,,,FALSE,FALSE,TRUE,TRUE
Freezer,,Spray Weapon,"Freezers spew out a fast-hardening foam that immediately begins to harden. They are primarily used as a non-lethal method of immobilizing or securing a target. Struck characters must immediately make a REF x 3 Test or become trapped. Apply a -30 modifier to this test if the attacker scored an Excellent Success (MoS 30+). The foam allows characters to breath even if their mouth and nose are covered, but it may impede sight. Freezer foam can be spiked with contact toxins or drugs to additionally sedate the target. It can also be used to construct temporary barricades or cover. Hardened foam has an Armor of 10 and Durability of 20. It slowly breaks down and degrades over a 12 hour period. Freezers are two-handed.",Moderate,,TRUE,EP.341,,,,,,SA,20,Spray Weapons,Cone,"G,D",,,FALSE,FALSE,TRUE,TRUE
Sprayer,,Spray Weapon,"This is a general-purpose two-handed squirtgun, loaded with tanks filled with the chemical or drug of the wielder's choice.",Low,,TRUE,EP.341,,,,,,SA,20,Spray Weapons,Cone,D,,,FALSE,FALSE,TRUE,TRUE
Sticky grenades,Sticky,Weapon Accessory,"Sticky grenades have a special coating that when triggered becomes a sticky adhesive, allowing the grenade to be stuck to almost any surface. Sticky grenades can even be wielded in melee combat, smacking them on an opponent to be detonated later.",Trivial,,TRUE,EP.341,,,,,,,,,,,,,FALSE,TRUE,FALSE,FALSE
Arm Slide,,Weapon Accessory,"This slide-mount can hold a pistol-sized weapon under a character’s sleeve, pushing the weapon into the character’s hand with an electronic signal or specific sequence of arm movements.",Low,,TRUE,EP.342,,,,,,,,,,,,,FALSE,TRUE,FALSE,FALSE
Extended Magazine,,Weapon Accessory,This ammunition case has an increased capacity. Increase the weapon’s ammo capacity by +50%. Only available for firearms and seekers.,Low,,TRUE,EP.342,,,,,,,%150,,,,,,FALSE,TRUE,FALSE,FALSE
Flash Suppressor,Suppressor,Weapon Accessory,"This device obscures the muzzle flash on firearms, applying a -10 modifier on Perception Tests to locate a ring weapon by its flash.",Low,,TRUE,EP.342,-10 to spot flash,,,,,,,,,,,,FALSE,TRUE,FALSE,FALSE
Gyromount,,Weapon Accessory,This weapon harness features a gyrostabilized weapon mount that keeps the weapon steady. Negates all modifiers from movement.,Moderate,,TRUE,EP.342,Ignore movement modifiers,,,,,,,,,,,,FALSE,TRUE,FALSE,FALSE
Imaging Scope,Scope,Weapon Accessory,"Imaging scopes attach to the top of the weapon and act like specs. Scopes may also bend like a periscope, along a character to point the weapon and target around corners without leaving cover.",Low,,TRUE,EP.342,,,,,,,,,,,,,FALSE,TRUE,FALSE,FALSE
Laser Sight,,Weapon Accessory,"This underbarrel laser emits a beam that places a glowing red dot on the target to assist targeting. Apply a +10 modifier to Attack Tests (not cumulative with a smartlink modifier). Laser sights may also be used to paint a target for laser-guided smart ammo or seekers. Infrared and ultraviolet lasers are also available, so that the dot is only visible to characters able to see in those spectrums.",Low,,TRUE,EP.342,,,,,10,,,,,,,,FALSE,TRUE,FALSE,FALSE
Safety System,,Weapon Accessory,"A biometric (palmprint or voiceprint) or ego ID sensor is embedded in the weapon, disabling it if anyone other than an authorized user attempts to fire it.",Low,,TRUE,EP.342,,,,,,,,,,,,,FALSE,TRUE,FALSE,FALSE
Shock Safety,,Weapon Accessory,"Just like a safety system, except that an unauthorized user is zapped with an electric shock. Treat as a shock baton.",Moderate,,TRUE,EP.342,,,,,,,,,,,,,FALSE,TRUE,FALSE,FALSE
Silencer/Sound Suppressor,Silencer,Weapon Accessory,This barrel-mounted accessory reduces the sound of a firearm's discharge. Apply a -10 modifier on hearing-based Perception Tests to hear or locate the gun's firing.,Moderate,,TRUE,EP.342,,,,,,,,,,,,,FALSE,TRUE,FALSE,FALSE
Smart Magazine,Smartmag,Weapon Accessory,"A smart magazine allows the character to pick and choose what ammo round will be fired with each shot. This system leaves less room for bullets, however, so reduce the weapon's ammunition capacity by half (round up). Smart magazines may be combined with extended magazines, in which case ammo capacity is normal.",Moderate,,TRUE,EP.342,,,,,,,/2,,,,,,FALSE,TRUE,FALSE,FALSE
Smartlink,,Weapon Accessory,"A smartlink system connects the weapon to the user's mesh inserts, placing a targeting bracket in the character's field of vision and providing range and targeting information. Apply a +10 modifier to the Attack Test. Smartlinks also incorporate a microcamera that allows the user to see what the weapon is pointed at, fire around corners, etc. Smartlinks also allow certain other types of weapon system control, such as changing flux ammo or programming seeker trigger conditions.",Moderate,,TRUE,EP.342,,,,,10,,,,,,,,FALSE,TRUE,FALSE,FALSE
Underbarrel Seeker,,Weapon Accessory,This seeker micromissile launcher is commonly attached to the underbarrel of SMGs or assault rifles. It fires in semi-auto mode.,Moderate,,TRUE,,,,,,,SA,6,Seeker Weapons,,,,,FALSE,FALSE,TRUE,TRUE